id,title,type,status,date,block_count,gates_passed,seo_meta,word_count_est,internal_links,notes
3956,Best Dog Toys UK (2026) – Complete Guide & Honest Reviews,Pillar,publish,2026-05-27,77,12/12,ok,4000,6,Existing pillar – migrated
3957,Best Indestructible Dog Toys UK (2026) – Tough Toys,Supporting,publish,2026-05-27,64,12/12,ok,3200,4,Gutenberg migrated
3959,Best Interactive Dog Toys UK (2026) – Puzzle & Enrichment,Supporting,publish,2026-05-27,76,12/12,ok,3500,4,Gutenberg migrated
3960,Best Puppy Toys UK (2026) – Teething & First Toys,Supporting,publish,2026-05-27,77,12/12,ok,3400,3,Gutenberg migrated
4787,Dog Toy Safety: What Every Owner Needs to Know,Informational,published,2026-05-27,32,12/12,ok,2000,3,New 10D expansion
4788,Mental Stimulation for Dogs: Beyond Physical Exercise,Informational,published,2026-05-27,35,12/12,ok,2100,2,New 10D expansion
4789,Best Types of Dog Toys for Different Play Styles,Informational,published,2026-05-27,33,12/12,ok,1950,3,New 10D expansion
4790,DIY Dog Toys: Safe Homemade Options,Informational,published,2026-05-27,33,12/12,ok,1800,2,New 10D expansion
