claim_id,post_id,URL,exact_claim_text,claim_category,risk_reason,evidence_present_yes_no,current_lint_state,recommended_remediation,rewrite_suggestion,escalation_required_yes_no,owner_review_required_yes_no,current_status,next_action
cl-3685adf8,3836,https://pethubonline.com/best-dog-food-uk/,"...What is the best dog food recommended by UK vets? UK vets commonly mention Royal...",veterinary_behaviour,"Implies specific professional/veterinary endorsement without named verified expert source; 'UK vets commonly mention' suggests broad vet consensus with no citation",yes,unchecked,soften_claim,"Soften to general guidance: 'Royal Canin is a popular choice among many dog owners and is often discussed in veterinary nutrition contexts' OR add a specific named vet/source citation e.g. 'Dr X of Y veterinary practice recommends...'",no,yes,flagged_for_review,owner_review_of_remediation_recommendation
cl-c4a7207a,3956,https://pethubonline.com/best-dog-toys-uk/,"...can be stuffed with treats. Widely recommended by UK vets and behaviourists. Chuckit!...",veterinary_behaviour,"Implies dual professional endorsement (vets and behaviourists) without named verified expert sources; 'widely recommended' is an unverified authority claim",yes,unchecked,soften_claim,"Soften to general guidance: 'A popular choice among dog owners and trainers for interactive play' OR add specific named vet/behaviourist citation e.g. 'Recommended by [Name], ABTC-registered behaviourist'",no,yes,flagged_for_review,owner_review_of_remediation_recommendation
cl-ebbb6cc0,4027,https://pethubonline.com/best-dog-collars-and-harnesses-uk/,"...not by causing pain. They are widely recommended by UK dog trainers and behaviourists as a...",veterinary_behaviour,"Implies professional endorsement by trainers and behaviourists without named verified expert sources; 'widely recommended' is an unverified authority claim",yes,unchecked,soften_claim,"Soften to general guidance: 'A common recommendation in positive reinforcement training circles' OR add specific named trainer/behaviourist citation e.g. 'Endorsed by [Name], IMDT-certified dog trainer'",no,yes,flagged_for_review,owner_review_of_remediation_recommendation
cl-1390c713,4103,https://pethubonline.com/best-dog-flea-treatment-uk/,"...the standard approach recommended by most UK vets Year-round treatment...",veterinary_behaviour,"Implies broad veterinary consensus ('most UK vets') without named verified expert source; presents editorial inference as established veterinary standard",yes,unchecked,soften_claim,"Soften to general guidance: 'Year-round flea treatment is widely considered the standard preventative approach' OR add specific named vet/source citation e.g. 'The BVA recommends year-round parasite prevention'",no,yes,flagged_for_review,owner_review_of_remediation_recommendation
cl-aa7ad158,4258,https://pethubonline.com/best-cat-collars-uk/,"...microchipping is strongly recommended by all UK animal welfare charities. A coll...",veterinary_behaviour,"References 'all UK animal welfare charities' as a blanket claim; while major charities (RSPCA, Cats Protection) do publicly recommend microchipping, the claim lacks specific named citations",yes,unchecked,add_evidence,"Add specific charity name citations: 'Microchipping is strongly recommended by leading UK animal welfare charities including Cats Protection, the RSPCA, and International Cat Care' with links to their microchipping guidance pages",no,yes,flagged_for_review,owner_review_of_remediation_recommendation
cl-8fd064b8,4272,https://pethubonline.com/best-cat-id-tags-uk/,"...it is strongly recommended by all UK animal charities as it significa...",veterinary_behaviour,"References 'all UK animal charities' as a blanket claim; while major charities do publicly recommend identification, the claim lacks specific named citations",yes,unchecked,add_evidence,"Add specific charity name citations: 'It is strongly recommended by leading UK animal charities including Cats Protection, the RSPCA, and Battersea' with links to their identification guidance pages",no,yes,flagged_for_review,owner_review_of_remediation_recommendation
