competitor,domain,estimated_da,content_volume,content_types,update_frequency,eeat_signals,strengths,weaknesses,threat_level
Cats.com,cats.com,69,"1000+ articles (estimated)","Vet-written health articles; breed guides; behavior guides; product reviews; cat news; educational videos","Weekly (regular new articles and updates)","Strong: named veterinarian authors (Dr. Sarah Wooten DVM; Dr. JoAnna Pendergrass DVM); editorial policy page; certified veterinary journalist; pet food consultant (Emma Passman); fact-checking process documented","Premium exact-match domain; strong E-E-A-T with named vets; 1M+ community; DR 69 (Ahrefs); 9.9K referring domains; comprehensive cat-only niche authority; vet-reviewed content badge","US-focused (not UK-specific); cat-only (no dogs/other pets); limited e-commerce; no physical retail presence",Medium
Pets at Home,petsathome.com,71,"10000+ pages (products + content hubs)","Product pages; pet health hub; training guides; advice articles; grooming service pages; vet service pages; loyalty program content","Daily (product updates); weekly (editorial content)","Strong: in-house vet teams; pet health and training hubs; expert-vetted content; 25-year domain age; Trustpilot 4.2/5 with 50K reviews; publicly traded company (FTSE 250)","UK market leader; 4.09M monthly visits; AS 71; 322.8K backlinks from 12.5K domains; omnichannel (450+ stores); $341M online revenue; grooming and vet services integrated; massive brand recognition","Content depth secondary to commerce; blog less prominent than product catalog; corporate voice may lack personality; higher prices than pure-play online",High
Zooplus,zooplus.co.uk,59,"5000+ pages (products + magazine articles)","Product catalog (food/toys/accessories); pet magazine with care articles; breed guides; feeding calculators; subscription services","Daily (product updates); weekly (magazine content)","Moderate: 25+ year brand history; European market leader; product expertise; care magazine with practical advice; no prominent named expert authors","1.5M monthly UK visits; Europe's leading online pet shop; 7% conversion rate; strong subscription model (31% of pet e-commerce); competitive pricing; broad product range (dogs/cats/small animals/birds/fish/horses); 33K UK Instagram followers","Lower authority score (59) vs Pets at Home; primarily e-commerce (thin content pages); limited UK-specific editorial depth; magazine content less prominent than shopping experience; no physical UK stores",Medium-High
Purina,purina.co.uk,70,"2000+ articles and pages (estimated)","Pet care advice hub; breed guides; nutrition articles; health and wellbeing content; puppy/kitten guides; product pages; community content; news section","Weekly (editorial content); regular product updates","Very Strong: Nestle-backed brand; in-house veterinary team; behaviourists and trainers on staff; 500K community members; decades of pet nutrition research; veterinary partnerships","724K monthly UK visits; AS 70; Nestle corporate backing; deep pet nutrition authority; comprehensive breed databases; strong E-E-A-T signals; 1.8M Facebook likes (global); vet-authored content; trusted household brand name","Content focused on own products (potential bias); not an independent information source; limited product range (Nestle brands only); 13K UK Instagram followers (relatively small); no e-commerce marketplace",Medium
Rover,rover.com,65,"3000+ blog posts and pages (estimated)","The Dog People blog; pet sitting guides; sitter resources; pet care tips; pet news roundups; how-to articles; community Q&A","Weekly (blog posts); regular community updates","Moderate: platform-verified sitters; blog content from experienced pet professionals; community-driven Q&A; 200K+ verified pet sitters; established marketplace trust signals","695K Instagram followers; strong blog (The Dog People); pet services marketplace leader; user-generated content and reviews; strong brand recognition in pet sitting/walking niche","US-focused platform; limited UK presence; service-only (no product sales); content focused on pet sitting/walking; not a pet products or general pet care competitor; AS 65",Low
