post_id,title,slug,link,word_count,h2_count,h3_count,img_count,internal_link_count,word_count_1500,h2_count_3,h3_count_2,has_definition_block,has_direct_answer,has_numbered_list,has_bullet_list,has_faq,has_sources,has_affiliate_links,has_images_2,has_internal_links_2,has_table,has_key_takeaways,has_author_box,total_score,percentage
8172,Our Research Standards,our-research-standards,https://pethubonline.com/our-research-standards/,3874,17,9,5,12,1,1,1,1,1,1,1,1,1,1,1,1,1,1,1,15,100.0
8171,Why PetHub Online Exists,why-pethub-online-exists,https://pethubonline.com/why-pethub-online-exists/,3329,14,7,4,11,1,1,1,1,1,1,1,1,1,1,1,1,1,1,1,15,100.0
7346,Indoor Cat Diet and Nutrition: Feeding Guidelines for House Cats,indoor-cat-diet-nutrition-guide,https://pethubonline.com/indoor-cat-diet-nutrition-guide/,3897,16,19,10,21,1,1,1,1,1,1,1,1,1,1,1,1,1,1,1,15,100.0
7345,Indoor Cat Behaviour: Understanding and Managing Common Issues,indoor-cat-behaviour-common-issues,https://pethubonline.com/indoor-cat-behaviour-common-issues/,3808,16,17,5,21,1,1,1,1,1,1,1,1,1,1,1,1,1,1,1,15,100.0
7344,Creating a Cat-Friendly Home: Environmental Enrichment for Indoor Cats,cat-friendly-home-enrichment-indoor-cats,https://pethubonline.com/cat-friendly-home-enrichment-indoor-cats/,3854,16,14,5,21,1,1,1,1,1,1,1,1,1,1,1,1,1,1,1,15,100.0
7343,Indoor Cat Safety: Common Household Hazards for Cats,indoor-cat-safety-household-hazards,https://pethubonline.com/indoor-cat-safety-household-hazards/,4017,17,12,5,21,1,1,1,1,1,1,1,1,1,1,1,1,1,1,1,15,100.0
7342,Indoor Cat Exercise: Keeping House Cats Active and Healthy,indoor-cat-exercise-guide,https://pethubonline.com/indoor-cat-exercise-guide/,3911,16,10,5,21,1,1,1,1,1,1,1,1,1,1,1,1,1,1,1,15,100.0
7340,"Puppy Teething Guide: Stages, Signs, and Soothing Tips",puppy-teething-guide-stages-signs,https://pethubonline.com/puppy-teething-guide-stages-signs/,4512,14,15,5,27,1,1,1,1,1,1,1,1,1,1,1,1,1,1,1,15,100.0
7339,Puppy Sleep Guide: How Much Sleep Puppies Need by Age,puppy-sleep-guide-by-age,https://pethubonline.com/puppy-sleep-guide-by-age/,4506,13,15,4,26,1,1,1,1,1,1,1,1,1,1,1,1,1,1,1,15,100.0
7338,Puppy-Proofing Your Home: A Room-by-Room Safety Guide,puppy-proofing-home-safety-guide,https://pethubonline.com/puppy-proofing-home-safety-guide/,4367,12,13,4,26,1,1,1,1,1,1,1,1,1,1,1,1,1,1,1,15,100.0
7337,Puppy Vaccination Schedule UK: What to Expect and When,puppy-vaccination-schedule-uk,https://pethubonline.com/puppy-vaccination-schedule-uk/,4982,14,19,5,16,1,1,1,1,1,1,1,1,1,1,1,1,1,1,1,15,100.0
7336,Dog Bed Safety: Avoiding Hazards and Choosing Non-Toxic Materials,dog-bed-safety-non-toxic-materials,https://pethubonline.com/dog-bed-safety-non-toxic-materials/,4652,15,12,5,22,1,1,1,1,1,1,1,1,1,1,1,1,1,1,1,15,100.0
7335,Seasonal Dog Bedding: Adjusting Comfort Through the Year,seasonal-dog-bedding-guide,https://pethubonline.com/seasonal-dog-bedding-guide/,4232,13,18,5,22,1,1,1,1,1,1,1,1,1,1,1,1,1,1,1,15,100.0
7334,Puppy Bed Training: Helping Your Dog Love Their Bed,puppy-bed-training-guide,https://pethubonline.com/puppy-bed-training-guide/,5015,14,16,5,24,1,1,1,1,1,1,1,1,1,1,1,1,1,1,1,15,100.0
7333,Dog Bed Placement Guide: Where to Put Your Dog’s Bed,dog-bed-placement-guide,https://pethubonline.com/dog-bed-placement-guide/,4771,14,14,5,22,1,1,1,1,1,1,1,1,1,1,1,1,1,1,1,15,100.0
7332,How to Wash and Dry a Dog Bed Safely,how-to-wash-dog-bed-safely,https://pethubonline.com/how-to-wash-dog-bed-safely/,4915,16,17,5,23,1,1,1,1,1,1,1,1,1,1,1,1,1,1,1,15,100.0
7177,Cat Toy Terminology: Understanding Play Types and Toy Features,cat-toy-terminology-understanding-play-types-and-toy-features,https://pethubonline.com/cat-toy-terminology-understanding-play-types-and-toy-features/,5216,12,32,4,19,1,1,1,1,1,1,1,1,1,1,1,1,1,1,1,15,100.0
7175,Cat Supply Essentials Glossary: Understanding Cat Care Products,cat-supply-essentials-glossary-understanding-cat-care-products,https://pethubonline.com/cat-supply-essentials-glossary-understanding-cat-care-products/,5047,11,33,4,23,1,1,1,1,1,1,1,1,1,1,1,1,1,1,1,15,100.0
7174,"Dog Bed Terminology: Materials, Types, and Sizing Terms Explained",dog-bed-terminology-materials-types-and-sizing-terms-explained,https://pethubonline.com/dog-bed-terminology-materials-types-and-sizing-terms-explained/,5225,10,30,4,19,1,1,1,1,1,1,1,1,1,1,1,1,1,1,1,15,100.0
7172,Dog Food Glossary: Understanding Ingredients and Nutrition Labels,dog-food-glossary-understanding-ingredients-and-nutrition-labels,https://pethubonline.com/dog-food-glossary-understanding-ingredients-and-nutrition-labels/,5875,8,34,4,15,1,1,1,1,1,1,1,1,1,1,1,1,1,1,1,15,100.0
7170,Dog Health Terminology: Understanding Common Veterinary and Care Terms,dog-health-terminology-understanding-common-veterinary-and-care-terms,https://pethubonline.com/dog-health-terminology-understanding-common-veterinary-and-care-terms/,5235,10,34,4,23,1,1,1,1,1,1,1,1,1,1,1,1,1,1,1,15,100.0
7169,Puppy Care Glossary: Essential Terms for New Puppy Owners,puppy-care-glossary-essential-terms-for-new-puppy-owners,https://pethubonline.com/puppy-care-glossary-essential-terms-for-new-puppy-owners/,5317,10,34,4,19,1,1,1,1,1,1,1,1,1,1,1,1,1,1,1,15,100.0
7167,Indoor Cat Terminology: A Complete Glossary for Cat Owners,indoor-cat-terminology-a-complete-glossary-for-cat-owners,https://pethubonline.com/indoor-cat-terminology-a-complete-glossary-for-cat-owners/,5365,11,37,4,17,1,1,1,1,1,1,1,1,1,1,1,1,1,1,1,15,100.0
6052,Low-Mobility Enrichment: Mental Stimulation for Dogs with Limited Movement,low-mobility-enrichment-dogs,https://pethubonline.com/low-mobility-enrichment-dogs/,3025,11,10,4,5,1,1,1,1,1,1,1,1,1,1,1,1,1,1,1,15,100.0
6049,Sensory Enrichment for Dogs: Engaging All Five Senses Through Play,sensory-enrichment-dogs,https://pethubonline.com/sensory-enrichment-dogs/,2916,11,9,4,10,1,1,1,1,1,1,1,1,1,1,1,1,1,1,1,15,100.0
6048,Confidence-Building Play: Helping Shy and Fearful Dogs Through Toys,confidence-building-play-dogs,https://pethubonline.com/confidence-building-play-dogs/,2283,13,10,4,8,1,1,1,1,1,1,1,1,1,1,1,1,1,1,1,15,100.0
6047,Play Recovery After Surgery: Gentle Enrichment for Healing Dogs,play-recovery-after-surgery-dogs,https://pethubonline.com/play-recovery-after-surgery-dogs/,2801,11,9,4,5,1,1,1,1,1,1,1,1,1,1,1,1,1,1,1,15,100.0
6046,Dog Toy Hygiene Schedules: A Practical Cleaning Timetable,dog-toy-hygiene-schedules,https://pethubonline.com/dog-toy-hygiene-schedules/,2841,11,9,4,6,1,1,1,1,1,1,1,1,1,1,1,1,1,1,1,15,100.0
6045,Safe Multi-Dog Toy Management: Preventing Resource Guarding,safe-multi-dog-toy-management,https://pethubonline.com/safe-multi-dog-toy-management/,2810,11,9,4,5,1,1,1,1,1,1,1,1,1,1,1,1,1,1,1,15,100.0
6044,Rotating Puzzle Complexity: Progressive Challenge for Smart Dogs,rotating-puzzle-complexity-dogs,https://pethubonline.com/rotating-puzzle-complexity-dogs/,2406,15,9,4,8,1,1,1,1,1,1,1,1,1,1,1,1,1,1,1,15,100.0
6042,Enrichment by Breed Group: Tailoring Play to Your Dog’s Instincts,enrichment-by-breed-group,https://pethubonline.com/enrichment-by-breed-group/,3933,9,10,4,17,1,1,1,1,1,1,1,1,1,1,1,1,1,1,1,15,100.0
5950,Dog Toy Durability Guide: What Lasts and What Does Not,dog-toy-durability-guide,https://pethubonline.com/dog-toy-durability-guide/,4140,16,17,5,19,1,1,1,1,1,1,1,1,1,1,1,1,1,1,1,15,100.0
5946,"Dog Toy Materials Compared: Rubber, Rope, Plush, and Nylon",dog-toy-materials-compared,https://pethubonline.com/dog-toy-materials-compared/,3831,13,20,5,17,1,1,1,1,1,1,1,1,1,1,1,1,1,1,1,15,100.0
5938,Enrichment Schedules for Dogs: Structuring Daily Play and Mental Work,enrichment-schedules-dogs,https://pethubonline.com/enrichment-schedules-dogs/,3851,14,18,4,17,1,1,1,1,1,1,1,1,1,1,1,1,1,1,1,15,100.0
5935,Dog Toy Storage and Organisation: Keeping Toys Clean and Accessible,dog-toy-storage-organisation,https://pethubonline.com/dog-toy-storage-organisation/,3568,13,15,5,17,1,1,1,1,1,1,1,1,1,1,1,1,1,1,1,15,100.0
5934,Crate and Play Enrichment: Keeping Dogs Happy in Confined Spaces,crate-play-enrichment-dogs,https://pethubonline.com/crate-play-enrichment-dogs/,3527,10,19,4,14,1,1,1,1,1,1,1,1,1,1,1,1,1,1,1,15,100.0
5933,"Safe Tug Play with Dogs: Rules, Benefits, and Common Mistakes",safe-tug-play-dogs,https://pethubonline.com/safe-tug-play-dogs/,3242,11,11,4,13,1,1,1,1,1,1,1,1,1,1,1,1,1,1,1,15,100.0
5932,Scent-Game Enrichment for Dogs: Using Smell to Engage Your Dog,scent-game-enrichment-dogs,https://pethubonline.com/scent-game-enrichment-dogs/,4031,10,20,4,13,1,1,1,1,1,1,1,1,1,1,1,1,1,1,1,15,100.0
5930,Dog Toy Safety by Breed Size: Choosing the Right Size Toy,dog-toy-safety-breed-size,https://pethubonline.com/dog-toy-safety-breed-size/,3813,9,19,4,13,1,1,1,1,1,1,1,1,1,1,1,1,1,1,1,15,100.0
5523,"Dog Training Equipment Explained: Tools, Uses, and What to Avoid",dog-training-equipment-guide,https://pethubonline.com/dog-training-equipment-guide/,6151,14,37,5,24,1,1,1,1,1,1,1,1,1,1,1,1,1,1,1,15,100.0
5521,Pet Health Terminology: A Guide to Common Veterinary Terms,pet-health-terminology-guide,https://pethubonline.com/pet-health-terminology-guide/,5853,14,38,5,17,1,1,1,1,1,1,1,1,1,1,1,1,1,1,1,15,100.0
5520,"Dog Health Basics: Common Conditions, Prevention, and When to See a Vet",dog-health-basics-guide,https://pethubonline.com/dog-health-basics-guide/,5946,18,33,5,21,1,1,1,1,1,1,1,1,1,1,1,1,1,1,1,15,100.0
5519,Indoor Cat Care: A Complete Guide to Keeping House Cats Happy and Healthy,indoor-cat-care-guide,https://pethubonline.com/indoor-cat-care-guide/,4696,17,26,5,19,1,1,1,1,1,1,1,1,1,1,1,1,1,1,1,15,100.0
5512,Dog Behaviour Explained: Understanding Your Dog’s Body Language and Actions,dog-behaviour-explained,https://pethubonline.com/dog-behaviour-explained/,5507,15,36,5,25,1,1,1,1,1,1,1,1,1,1,1,1,1,1,1,15,100.0
5511,"Pet Enrichment Explained: Types, Benefits, and Practical Ideas",pet-enrichment-guide,https://pethubonline.com/pet-enrichment-guide/,4473,16,34,5,16,1,1,1,1,1,1,1,1,1,1,1,1,1,1,1,15,100.0
5510,Dog Bed Sizing Guide: How to Measure Your Dog and Choose the Right Fit,dog-bed-sizing-guide,https://pethubonline.com/dog-bed-sizing-guide/,5545,15,25,5,10,1,1,1,1,1,1,1,1,1,1,1,1,1,1,1,15,100.0
5509,"Pet Toy Safety: Understanding Materials, Hazards, and Standards",pet-toy-safety-guide,https://pethubonline.com/pet-toy-safety-guide/,6912,16,29,5,15,1,1,1,1,1,1,1,1,1,1,1,1,1,1,1,15,100.0
5508,Puppy Development Stages: A Complete Guide from Birth to Maturity,puppy-development-stages-guide,https://pethubonline.com/puppy-development-stages-guide/,6357,15,34,5,24,1,1,1,1,1,1,1,1,1,1,1,1,1,1,1,15,100.0
5483,Dog Toy Lifespan: When to Replace Toys and How to Extend Their Life,dog-toy-lifespan-replacement,https://pethubonline.com/dog-toy-lifespan-replacement/,5952,16,30,5,16,1,1,1,1,1,1,1,1,1,1,1,1,1,1,1,15,100.0
5476,"Mental Stimulation Toys for Dogs: Puzzles, Games, and Brain Work",mental-stimulation-toys-dogs,https://pethubonline.com/mental-stimulation-toys-dogs/,4753,17,20,5,18,1,1,1,1,1,1,1,1,1,1,1,1,1,1,1,15,100.0
5471,"Dog Boredom Prevention: Signs, Solutions, and Enrichment Ideas",dog-boredom-prevention,https://pethubonline.com/dog-boredom-prevention/,4718,18,18,5,16,1,1,1,1,1,1,1,1,1,1,1,1,1,1,1,15,100.0
5469,Dog Toy Rotation: How to Keep Your Dog Interested and Engaged,dog-toy-rotation-guide,https://pethubonline.com/dog-toy-rotation-guide/,4884,18,24,5,17,1,1,1,1,1,1,1,1,1,1,1,1,1,1,1,15,100.0
5467,"Pet Feeding Guide: Understanding Portions, Schedules, and Methods",pet-feeding-guide,https://pethubonline.com/pet-feeding-guide/,6784,16,27,5,17,1,1,1,1,1,1,1,1,1,1,1,1,1,1,1,15,100.0
5464,Pet Grooming Glossary: Understanding Grooming Terms and Techniques,pet-grooming-glossary,https://pethubonline.com/pet-grooming-glossary/,5910,14,29,5,15,1,1,1,1,1,1,1,1,1,1,1,1,1,1,1,15,100.0
5462,Dog Training Terminology Explained: Key Concepts for New Owners,dog-training-terminology-explained,https://pethubonline.com/dog-training-terminology-explained/,3150,15,23,4,2,1,1,1,1,1,1,1,1,1,1,1,1,1,1,1,15,100.0
5460,Pet Nutrition Terminology: A Guide to Common Terms on Pet Food Labels,pet-nutrition-terminology-guide,https://pethubonline.com/pet-nutrition-terminology-guide/,6318,13,27,4,17,1,1,1,1,1,1,1,1,1,1,1,1,1,1,1,15,100.0
5458,Cat Scratching Behaviour Explained: Why Cats Scratch and How to Help,cat-scratching-behaviour-explained,https://pethubonline.com/cat-scratching-behaviour-explained/,3495,15,21,5,13,1,1,1,1,1,1,1,1,1,1,1,1,1,1,1,15,100.0
5425,Dog Toys FAQ: Common Questions Answered,dog-toys-faq,https://pethubonline.com/dog-toys-faq/,5591,18,14,5,23,1,1,1,1,1,1,1,1,1,1,1,1,1,1,1,15,100.0
5424,Aggressive Chewer Guide: Safe Toys for Power Chewers,aggressive-chewer-dog-toys,https://pethubonline.com/aggressive-chewer-dog-toys/,4496,13,17,5,20,1,1,1,1,1,1,1,1,1,1,1,1,1,1,1,15,100.0
5423,Dog Toy Enrichment: Beyond Basic Fetch,dog-toy-enrichment-beyond-fetch,https://pethubonline.com/dog-toy-enrichment-beyond-fetch/,4777,15,17,5,19,1,1,1,1,1,1,1,1,1,1,1,1,1,1,1,15,100.0
5422,Indoor vs Outdoor Dog Toys: Choosing the Right Type,indoor-vs-outdoor-dog-toys,https://pethubonline.com/indoor-vs-outdoor-dog-toys/,4923,13,23,5,21,1,1,1,1,1,1,1,1,1,1,1,1,1,1,1,15,100.0
5421,Puppy-Safe Dog Toys: What to Look For and What to Avoid,puppy-safe-dog-toys,https://pethubonline.com/puppy-safe-dog-toys/,5038,15,23,5,17,1,1,1,1,1,1,1,1,1,1,1,1,1,1,1,15,100.0
5420,Dog Toy Cleaning Guide: How to Keep Toys Hygienic,dog-toy-cleaning-guide,https://pethubonline.com/dog-toy-cleaning-guide/,4647,16,17,5,17,1,1,1,1,1,1,1,1,1,1,1,1,1,1,1,15,100.0
5419,Cat Care Basics: A Glossary for New Cat Owners,cat-care-basics-glossary,https://pethubonline.com/cat-care-basics-glossary/,4476,9,20,5,12,1,1,1,1,1,1,1,1,1,1,1,1,1,1,1,15,100.0
5418,Dog Harness Types Explained: Finding the Right Fit,dog-harness-types-glossary,https://pethubonline.com/dog-harness-types-glossary/,5662,9,25,5,17,1,1,1,1,1,1,1,1,1,1,1,1,1,1,1,15,100.0
5417,Puppy Care Essentials: Key Terms Every New Owner Should Know,puppy-care-essentials-glossary,https://pethubonline.com/puppy-care-essentials-glossary/,3333,11,19,4,10,1,1,1,1,1,1,1,1,1,1,1,1,1,1,1,15,100.0
5416,Dog Bed Types Explained: A Complete Glossary,dog-bed-types-glossary,https://pethubonline.com/dog-bed-types-glossary/,5144,9,17,4,16,1,1,1,1,1,1,1,1,1,1,1,1,1,1,1,15,100.0
5415,Dog Play Styles Explained: Understanding How Your Dog Plays,dog-play-styles-explained,https://pethubonline.com/dog-play-styles-explained/,3697,11,14,4,18,1,1,1,1,1,1,1,1,1,1,1,1,1,1,1,15,100.0
5414,Cat Toy Types Explained: A Complete Glossary,cat-toy-types-glossary,https://pethubonline.com/cat-toy-types-glossary/,4331,13,23,5,16,1,1,1,1,1,1,1,1,1,1,1,1,1,1,1,15,100.0
5296,Best Indoor Cat Toys UK (2026): Complete Guide for House Cats,best-indoor-cat-toys,https://pethubonline.com/best-indoor-cat-toys/,3475,12,13,4,21,1,1,1,1,1,1,1,1,1,1,1,1,1,1,1,15,100.0
5033,How to Choose the Right Cat Toy for Your Cat’s Personality,how-to-choose-cat-toys-personality,https://pethubonline.com/how-to-choose-cat-toys-personality/,4292,13,15,5,27,1,1,1,1,1,1,1,1,1,1,1,1,1,1,1,15,100.0
5036,Understanding Cat Play Behaviour: What Different Play Styles Mean,understanding-cat-play-behaviour,https://pethubonline.com/understanding-cat-play-behaviour/,4093,14,15,5,22,1,1,1,1,1,1,1,1,1,1,1,1,1,1,1,15,100.0
5032,Cat Toys FAQ: Common Questions Answered,cat-toys-faq,https://pethubonline.com/cat-toys-faq/,4618,15,17,5,25,1,1,1,1,1,1,1,1,1,1,1,1,1,1,1,15,100.0
5035,Cat Enrichment Beyond Toys: Creating a Stimulating Home,cat-enrichment-beyond-toys,https://pethubonline.com/cat-enrichment-beyond-toys/,4522,13,12,5,18,1,1,1,1,1,1,1,1,1,1,1,1,1,1,1,15,100.0
5034,Cat Toy Rotation: How to Keep Toys Fresh and Engaging,cat-toy-rotation-guide,https://pethubonline.com/cat-toy-rotation-guide/,3504,13,10,4,13,1,1,1,1,1,1,1,1,1,1,1,1,1,1,1,15,100.0
4792,Puppy Socialisation: A Complete Timeline Guide,puppy-socialisation-guide,https://pethubonline.com/puppy-socialisation-guide/,4995,15,13,5,28,1,1,1,1,1,1,1,1,1,1,1,1,1,1,1,15,100.0
4791,How to Choose the Right Dog Training Treats,how-to-choose-dog-training-treats,https://pethubonline.com/how-to-choose-dog-training-treats/,4216,15,11,5,23,1,1,1,1,1,1,1,1,1,1,1,1,1,1,1,15,100.0
4790,DIY Dog Toys: Safe Homemade Options,diy-dog-toys-homemade,https://pethubonline.com/diy-dog-toys-homemade/,3996,15,7,5,16,1,1,1,1,1,1,1,1,1,1,1,1,1,1,1,15,100.0
4789,Best Types of Dog Toys for Different Play Styles,dog-toys-for-different-play-styles,https://pethubonline.com/dog-toys-for-different-play-styles/,4019,15,9,5,16,1,1,1,1,1,1,1,1,1,1,1,1,1,1,1,15,100.0
4788,Mental Stimulation for Dogs: Beyond Physical Exercise,mental-stimulation-for-dogs,https://pethubonline.com/mental-stimulation-for-dogs/,4180,15,11,5,17,1,1,1,1,1,1,1,1,1,1,1,1,1,1,1,15,100.0
4787,Dog Toy Safety: What Every Owner Needs to Know,dog-toy-safety-guide,https://pethubonline.com/dog-toy-safety-guide/,3826,15,8,5,16,1,1,1,1,1,1,1,1,1,1,1,1,1,1,1,15,100.0
4786,Where to Place Your Dog’s Bed: Location and Comfort Tips,where-to-place-dog-bed,https://pethubonline.com/where-to-place-dog-bed/,4303,15,11,5,17,1,1,1,1,1,1,1,1,1,1,1,1,1,1,1,15,100.0
4785,How to Wash and Maintain Your Dog’s Bed,how-to-wash-dog-bed,https://pethubonline.com/how-to-wash-dog-bed/,4259,15,12,5,17,1,1,1,1,1,1,1,1,1,1,1,1,1,1,1,15,100.0
4784,"Dog Bed Materials Explained: Foam, Memory Foam, and More",dog-bed-materials-guide,https://pethubonline.com/dog-bed-materials-guide/,4394,15,11,5,20,1,1,1,1,1,1,1,1,1,1,1,1,1,1,1,15,100.0
4783,How to Choose the Right Dog Bed Size,how-to-choose-dog-bed-size,https://pethubonline.com/how-to-choose-dog-bed-size/,4313,14,11,5,16,1,1,1,1,1,1,1,1,1,1,1,1,1,1,1,15,100.0
4573,Seasonal Pet Safety: Protecting Pets Through the Year,seasonal-pet-safety-guide,https://pethubonline.com/seasonal-pet-safety-guide/,2851,11,9,4,16,1,1,1,1,1,1,1,1,1,1,1,1,1,1,1,15,100.0
4570,First-Time Dog Owner Essentials: What You Need to Know,first-time-dog-owner-essentials,https://pethubonline.com/first-time-dog-owner-essentials/,4831,12,10,4,21,1,1,1,1,1,1,1,1,1,1,1,1,1,1,1,15,100.0
4576,Multi-Pet Household Tips: Living with Dogs and Cats Together,multi-pet-household-tips,https://pethubonline.com/multi-pet-household-tips/,2814,11,7,4,12,1,1,1,1,1,1,1,1,1,1,1,1,1,1,1,15,100.0
4571,Pet First Aid Basics: What Every Owner Should Know,pet-first-aid-basics,https://pethubonline.com/pet-first-aid-basics/,3679,11,12,4,23,1,1,1,1,1,1,1,1,1,1,1,1,1,1,1,15,100.0
4566,Seasonal Dog Care: Keeping Your Dog Safe Year-Round,seasonal-dog-care-guide,https://pethubonline.com/seasonal-dog-care-guide/,4260,11,14,5,16,1,1,1,1,1,1,1,1,1,1,1,1,1,1,1,15,100.0
4563,Dog Grooming Basics: A Complete Guide for Owners,dog-grooming-basics-guide,https://pethubonline.com/dog-grooming-basics-guide/,3898,6,6,5,14,1,1,1,1,1,1,1,1,1,1,1,1,1,1,1,15,100.0
4415,Cat Toy Safety Guide: What Every Owner Should Know,cat-toy-safety-guide,https://pethubonline.com/cat-toy-safety-guide/,4281,14,19,5,22,1,1,1,1,1,1,1,1,1,1,1,1,1,1,1,15,100.0
4406,Best Interactive Cat Toys for Indoor Cats: Engagement Guide,best-interactive-cat-toys-indoor-cats,https://pethubonline.com/best-interactive-cat-toys-indoor-cats/,3216,10,15,5,18,1,1,1,1,1,1,1,1,1,1,1,1,1,1,1,15,100.0
4414,Harness vs Collar: Which Is Better for Your Dog?,harness-vs-collar-which-is-better,https://pethubonline.com/harness-vs-collar-which-is-better/,4100,4,11,5,14,1,1,1,1,1,1,1,1,1,1,1,1,1,1,1,15,100.0
4413,How to Measure Your Dog for a Harness: Step-by-Step Guide,how-to-measure-dog-for-harness,https://pethubonline.com/how-to-measure-dog-for-harness/,3597,4,11,5,14,1,1,1,1,1,1,1,1,1,1,1,1,1,1,1,15,100.0
4411,"Dog Harnesses: The Complete Guide to Types, Fitting, and Safety",dog-harnesses-complete-guide,https://pethubonline.com/dog-harnesses-complete-guide/,4394,11,19,4,26,1,1,1,1,1,1,1,1,1,1,1,1,1,1,1,15,100.0
4410,Cat Enrichment Activities Beyond Toys: Complete Guide,cat-enrichment-activities-beyond-toys,https://pethubonline.com/cat-enrichment-activities-beyond-toys/,4098,15,20,5,22,1,1,1,1,1,1,1,1,1,1,1,1,1,1,1,15,100.0
4409,Kitten vs Adult Cat Toys: Age-Appropriate Play Guide,kitten-vs-adult-cat-toys-age-appropriate,https://pethubonline.com/kitten-vs-adult-cat-toys-age-appropriate/,4340,12,18,4,25,1,1,1,1,1,1,1,1,1,1,1,1,1,1,1,15,100.0
4408,How Often Should You Replace Cat Toys? A Practical Guide,how-often-replace-cat-toys,https://pethubonline.com/how-often-replace-cat-toys/,4261,12,22,4,24,1,1,1,1,1,1,1,1,1,1,1,1,1,1,1,15,100.0
4407,DIY Cat Toys: Safe Homemade Options Your Cat Will Love,diy-cat-toys-safe-homemade-options,https://pethubonline.com/diy-cat-toys-safe-homemade-options/,3400,11,16,4,18,1,1,1,1,1,1,1,1,1,1,1,1,1,1,1,15,100.0
4335,Best Cat Litter Disposal UK (2026) – Waste Management Guide,best-cat-litter-disposal-uk,https://pethubonline.com/best-cat-litter-disposal-uk/,4825,18,23,8,23,1,1,1,1,1,1,1,1,1,1,1,1,1,1,1,15,100.0
4328,Best Self-Cleaning Litter Trays UK (2026) – Automatic Options,best-self-cleaning-litter-trays-uk,https://pethubonline.com/best-self-cleaning-litter-trays-uk/,4156,15,18,8,17,1,1,1,1,1,1,1,1,1,1,1,1,1,1,1,15,100.0
4321,Best Cat Litter UK (2026) – Types & Comparison Guide,best-cat-litter-uk,https://pethubonline.com/best-cat-litter-uk/,4485,14,21,8,23,1,1,1,1,1,1,1,1,1,1,1,1,1,1,1,15,100.0
4314,Best Cat Litter Trays UK (2026) – Complete Guide,best-cat-litter-trays-uk,https://pethubonline.com/best-cat-litter-trays-uk/,5218,19,27,8,23,1,1,1,1,1,1,1,1,1,1,1,1,1,1,1,15,100.0
4307,Best Wall-Mounted Cat Scratchers UK (2026) – Space Saving,best-wall-mounted-cat-scratchers-uk,https://pethubonline.com/best-wall-mounted-cat-scratchers-uk/,4589,17,24,8,20,1,1,1,1,1,1,1,1,1,1,1,1,1,1,1,15,100.0
4300,Best Cardboard Cat Scratchers UK (2026) – Budget Friendly,best-cardboard-cat-scratchers-uk,https://pethubonline.com/best-cardboard-cat-scratchers-uk/,4635,17,25,8,20,1,1,1,1,1,1,1,1,1,1,1,1,1,1,1,15,100.0
4293,Best Cat Trees UK (2026) – Climbing & Scratching Towers,best-cat-trees-uk,https://pethubonline.com/best-cat-trees-uk/,4009,15,19,8,16,1,1,1,1,1,1,1,1,1,1,1,1,1,1,1,15,100.0
4286,Best Cat Scratching Posts UK (2026) – Complete Guide,best-cat-scratching-posts-uk,https://pethubonline.com/best-cat-scratching-posts-uk/,4723,16,19,8,22,1,1,1,1,1,1,1,1,1,1,1,1,1,1,1,15,100.0
4251,Best Cat Shampoo UK (2026) – When & How to Bathe,best-cat-shampoo-uk,https://pethubonline.com/best-cat-shampoo-uk/,3764,13,13,8,18,1,1,1,1,1,1,1,1,1,1,1,1,1,1,1,15,100.0
4244,Best Cat Nail Clippers UK (2026) – Safe Trimming Guide,best-cat-nail-clippers-uk,https://pethubonline.com/best-cat-nail-clippers-uk/,3167,13,10,8,8,1,1,1,1,1,1,1,1,1,1,1,1,1,1,1,15,100.0
4237,Best Cat Brushes UK (2026) – Guide by Coat Type,best-cat-brushes-uk,https://pethubonline.com/best-cat-brushes-uk/,3046,12,11,3,9,1,1,1,1,1,1,1,1,1,1,1,1,1,1,1,15,100.0
4223,Best Cat Window Perches UK (2026) – Sunning & Bird Watching,best-cat-window-perches-uk,https://pethubonline.com/best-cat-window-perches-uk/,3813,14,14,3,19,1,1,1,1,1,1,1,1,1,1,1,1,1,1,1,15,100.0
4216,Best Cat Radiator Beds UK (2026) – Hook-On Warmth Guide,best-cat-radiator-beds-uk,https://pethubonline.com/best-cat-radiator-beds-uk/,3969,14,15,3,19,1,1,1,1,1,1,1,1,1,1,1,1,1,1,1,15,100.0
4209,Best Heated Cat Beds UK (2026) – Winter Warmth Guide,best-heated-cat-beds-uk,https://pethubonline.com/best-heated-cat-beds-uk/,4131,14,17,3,19,1,1,1,1,1,1,1,1,1,1,1,1,1,1,1,15,100.0
4202,Best Cat Beds UK (2026) – Complete Guide,best-cat-beds-uk,https://pethubonline.com/best-cat-beds-uk/,4405,14,21,3,19,1,1,1,1,1,1,1,1,1,1,1,1,1,1,1,15,100.0
4195,Best Cat Toys for Indoor Cats UK (2026) – Enrichment Guide,best-cat-toys-indoor-cats-uk,https://pethubonline.com/best-cat-toys-indoor-cats-uk/,4766,17,24,3,14,1,1,1,1,1,1,1,1,1,1,1,1,1,1,1,15,100.0
4188,Best Catnip Toys UK (2026) – What Works and Why,best-catnip-toys-uk,https://pethubonline.com/best-catnip-toys-uk/,4620,13,19,8,39,1,1,1,1,1,1,1,1,1,1,1,1,1,1,1,15,100.0
4181,Best Interactive Cat Toys UK (2026) – Wand & Puzzle Guide,best-interactive-cat-toys-uk,https://pethubonline.com/best-interactive-cat-toys-uk/,5240,15,26,8,33,1,1,1,1,1,1,1,1,1,1,1,1,1,1,1,15,100.0
4174,Best Cat Toys UK (2026) – Complete Guide,best-cat-toys-uk,https://pethubonline.com/best-cat-toys-uk/,5709,16,29,8,37,1,1,1,1,1,1,1,1,1,1,1,1,1,1,1,15,100.0
4167,Best Dog Water Bottles UK (2026) – Travel Hydration Guide,best-dog-water-bottles-uk,https://pethubonline.com/best-dog-water-bottles-uk/,4747,16,16,8,28,1,1,1,1,1,1,1,1,1,1,1,1,1,1,1,15,100.0
4160,Best Elevated Dog Bowls UK (2026) – Raised Feeder Guide,best-elevated-dog-bowls-uk,https://pethubonline.com/best-elevated-dog-bowls-uk/,4468,16,15,8,23,1,1,1,1,1,1,1,1,1,1,1,1,1,1,1,15,100.0
4153,Best Slow Feeder Dog Bowls UK (2026) – Prevent Speed Eating,best-slow-feeder-dog-bowls-uk,https://pethubonline.com/best-slow-feeder-dog-bowls-uk/,4591,15,20,8,17,1,1,1,1,1,1,1,1,1,1,1,1,1,1,1,15,100.0
4146,Best Dog Bowls and Feeding UK (2026) – Complete Guide,best-dog-bowls-feeding-uk,https://pethubonline.com/best-dog-bowls-feeding-uk/,4461,16,16,8,18,1,1,1,1,1,1,1,1,1,1,1,1,1,1,1,15,100.0
4139,Best Dog Training Leads UK (2026) – Long Lines & Harnesses,best-dog-training-leads-uk,https://pethubonline.com/best-dog-training-leads-uk/,5014,15,15,8,17,1,1,1,1,1,1,1,1,1,1,1,1,1,1,1,15,100.0
4132,Best Puppy Training Guide UK (2026) – First Year Essentials,best-puppy-training-guide-uk,https://pethubonline.com/best-puppy-training-guide-uk/,4923,15,17,8,19,1,1,1,1,1,1,1,1,1,1,1,1,1,1,1,15,100.0
4125,Best Dog Training Treats UK (2026) – Reward Guide,best-dog-training-treats-uk,https://pethubonline.com/best-dog-training-treats-uk/,4587,15,17,8,17,1,1,1,1,1,1,1,1,1,1,1,1,1,1,1,15,100.0
