id,title,slug,cluster,internal_link_count,has_related_reading,needs_reinforcement
6052,Low-Mobility Enrichment: Mental Stimulation for Dogs with Limited Movement,low-mobility-enrichment-dogs,Dog Toys,10,True,False
6050,Toy Overstimulation Recovery: Calming Down an Overexcited Dog,toy-overstimulation-recovery-dogs,Dog Toys,11,True,False
6049,Sensory Enrichment for Dogs: Engaging All Five Senses Through Play,sensory-enrichment-dogs,Dog Toys,10,True,False
6048,Confidence-Building Play: Helping Shy and Fearful Dogs Through Toys,confidence-building-play-dogs,Dog Toys,9,True,False
6047,Play Recovery After Surgery: Gentle Enrichment for Healing Dogs,play-recovery-after-surgery-dogs,Dog Toys,10,True,False
6046,Dog Toy Hygiene Schedules: A Practical Cleaning Timetable,dog-toy-hygiene-schedules,Dog Toys,11,True,False
6045,Safe Multi-Dog Toy Management: Preventing Resource Guarding,safe-multi-dog-toy-management,Dog Toys,10,True,False
6044,Rotating Puzzle Complexity: Progressive Challenge for Smart Dogs,rotating-puzzle-complexity-dogs,Dog Toys,9,True,False
6042,Enrichment by Breed Group: Tailoring Play to Your Dog’s Instincts,enrichment-by-breed-group,Dog Toys,12,True,False
6039,Dog Toy Anxiety Reduction: Using Toys to Calm Nervous Dogs,dog-toy-anxiety-reduction,Dog Toys,9,True,False
5950,Dog Toy Durability Guide: What Lasts and What Does Not,dog-toy-durability-guide,Dog Toys,14,True,False
5946,"Dog Toy Materials Compared: Rubber, Rope, Plush, and Nylon",dog-toy-materials-compared,Dog Toys,12,True,False
5942,Cognitive Enrichment for Senior Dogs: Gentle Play for Ageing Minds,cognitive-enrichment-senior-dogs,Other,10,True,False
5938,Enrichment Schedules for Dogs: Structuring Daily Play and Mental Work,enrichment-schedules-dogs,Other,13,True,False
5935,Dog Toy Storage and Organisation: Keeping Toys Clean and Accessible,dog-toy-storage-organisation,Dog Toys,12,True,False
5934,Crate and Play Enrichment: Keeping Dogs Happy in Confined Spaces,crate-play-enrichment-dogs,Dog Toys,6,True,False
5933,"Safe Tug Play with Dogs: Rules, Benefits, and Common Mistakes",safe-tug-play-dogs,Dog Toys,5,True,False
5932,Scent-Game Enrichment for Dogs: Using Smell to Engage Your Dog,scent-game-enrichment-dogs,Dog Toys,5,True,False
5931,Signs of Toy Overstimulation in Dogs: When Play Becomes Too Much,dog-toy-overstimulation-signs,Dog Toys,5,True,False
5930,Dog Toy Safety by Breed Size: Choosing the Right Size Toy,dog-toy-safety-breed-size,Dog Toys,5,True,False
5523,"Dog Training Equipment Explained: Tools, Uses, and What to Avoid",dog-training-equipment-guide,Dog Training,15,True,False
5522,"Orthopaedic Care for Dogs: Joint Health, Mobility, and Support",orthopaedic-care-dogs,Dog Health,15,True,False
5521,Pet Health Terminology: A Guide to Common Veterinary Terms,pet-health-terminology-guide,Dog Health,9,True,False
5520,"Dog Health Basics: Common Conditions, Prevention, and When to See a Vet",dog-health-basics-guide,Dog Health,16,True,False
5519,Indoor Cat Care: A Complete Guide to Keeping House Cats Happy and Healthy,indoor-cat-care-guide,Cat Supplies,20,True,False
5512,Dog Behaviour Explained: Understanding Your Dog’s Body Language and Actions,dog-behaviour-explained,Dog Training,16,True,False
5511,"Pet Enrichment Explained: Types, Benefits, and Practical Ideas",pet-enrichment-guide,Pet Care,8,True,False
5510,Dog Bed Sizing Guide: How to Measure Your Dog and Choose the Right Fit,dog-bed-sizing-guide,Dog Beds,11,True,False
5509,"Pet Toy Safety: Understanding Materials, Hazards, and Standards",pet-toy-safety-guide,Dog Toys,10,True,False
5508,Puppy Development Stages: A Complete Guide from Birth to Maturity,puppy-development-stages-guide,Puppy Care,14,True,False
5483,Dog Toy Lifespan: When to Replace Toys and How to Extend Their Life,dog-toy-lifespan-replacement,Dog Toys,11,True,False
5476,"Mental Stimulation Toys for Dogs: Puzzles, Games, and Brain Work",mental-stimulation-toys-dogs,Dog Toys,13,True,False
5473,Senior Dog Toys: Gentle Play Options for Older Dogs,senior-dog-toys,Dog Toys,7,True,False
5471,"Dog Boredom Prevention: Signs, Solutions, and Enrichment Ideas",dog-boredom-prevention,Dog Toys,8,True,False
5469,Dog Toy Rotation: How to Keep Your Dog Interested and Engaged,dog-toy-rotation-guide,Dog Toys,9,True,False
5467,"Pet Feeding Guide: Understanding Portions, Schedules, and Methods",pet-feeding-guide,Dog Food,12,True,False
5464,Pet Grooming Glossary: Understanding Grooming Terms and Techniques,pet-grooming-glossary,Dog Grooming,10,True,False
5462,Dog Training Terminology Explained: Key Concepts for New Owners,dog-training-terminology-explained,Dog Training,11,True,False
5460,Pet Nutrition Terminology: A Guide to Common Terms on Pet Food Labels,pet-nutrition-terminology-guide,Dog Food,12,True,False
5458,Cat Scratching Behaviour Explained: Why Cats Scratch and How to Help,cat-scratching-behaviour-explained,Dog Training,15,True,False
5425,Dog Toys FAQ: Common Questions Answered,dog-toys-faq,Dog Toys,18,True,False
5424,Aggressive Chewer Guide: Safe Toys for Power Chewers,aggressive-chewer-dog-toys,Dog Toys,15,True,False
5423,Dog Toy Enrichment: Beyond Basic Fetch,dog-toy-enrichment-beyond-fetch,Dog Toys,14,True,False
5422,Indoor vs Outdoor Dog Toys: Choosing the Right Type,indoor-vs-outdoor-dog-toys,Dog Toys,16,True,False
5421,Puppy-Safe Dog Toys: What to Look For and What to Avoid,puppy-safe-dog-toys,Dog Toys,12,True,False
5420,Dog Toy Cleaning Guide: How to Keep Toys Hygienic,dog-toy-cleaning-guide,Dog Toys,12,True,False
5419,Cat Care Basics: A Glossary for New Cat Owners,cat-care-basics-glossary,Cat Supplies,6,True,False
5418,Dog Harness Types Explained: Finding the Right Fit,dog-harness-types-glossary,Dog Harnesses,9,True,False
5417,Puppy Care Essentials: Key Terms Every New Owner Should Know,puppy-care-essentials-glossary,Puppy Care,18,False,False
5416,Dog Bed Types Explained: A Complete Glossary,dog-bed-types-glossary,Dog Beds,11,True,False
5415,Dog Play Styles Explained: Understanding How Your Dog Plays,dog-play-styles-explained,Dog Toys,13,True,False
5414,Cat Toy Types Explained: A Complete Glossary,cat-toy-types-glossary,Cat Toys,11,True,False
5296,Best Indoor Cat Toys UK (2026): Complete Guide for House Cats,best-indoor-cat-toys,Cat Supplies,18,True,False
5033,How to Choose the Right Cat Toy for Your Cat’s Personality,how-to-choose-cat-toys-personality,Cat Toys,22,True,False
5036,Understanding Cat Play Behaviour: What Different Play Styles Mean,understanding-cat-play-behaviour,Dog Toys,17,True,False
5032,Cat Toys FAQ: Common Questions Answered,cat-toys-faq,Cat Toys,20,True,False
5035,Cat Enrichment Beyond Toys: Creating a Stimulating Home,cat-enrichment-beyond-toys,Cat Toys,13,True,False
5034,Cat Toy Rotation: How to Keep Toys Fresh and Engaging,cat-toy-rotation-guide,Dog Toys,12,True,False
4792,Puppy Socialisation: A Complete Timeline Guide,puppy-socialisation-guide,Puppy Care,19,True,False
4791,How to Choose the Right Dog Training Treats,how-to-choose-dog-training-treats,Dog Training,14,True,False
4790,DIY Dog Toys: Safe Homemade Options,diy-dog-toys-homemade,Dog Toys,11,True,False
4789,Best Types of Dog Toys for Different Play Styles,dog-toys-for-different-play-styles,Dog Toys,11,True,False
4788,Mental Stimulation for Dogs: Beyond Physical Exercise,mental-stimulation-for-dogs,Other,9,True,False
4787,Dog Toy Safety: What Every Owner Needs to Know,dog-toy-safety-guide,Dog Toys,11,True,False
4786,Where to Place Your Dog’s Bed: Location and Comfort Tips,where-to-place-dog-bed,Other,12,True,False
4785,How to Wash and Maintain Your Dog’s Bed,how-to-wash-dog-bed,Other,12,True,False
4784,"Dog Bed Materials Explained: Foam, Memory Foam, and More",dog-bed-materials-guide,Dog Beds,15,True,False
4783,How to Choose the Right Dog Bed Size,how-to-choose-dog-bed-size,Dog Beds,8,True,False
4573,Seasonal Pet Safety: Protecting Pets Through the Year,seasonal-pet-safety-guide,Pet Care,9,True,False
4570,First-Time Dog Owner Essentials: What You Need to Know,first-time-dog-owner-essentials,Puppy Care,16,True,False
4576,Multi-Pet Household Tips: Living with Dogs and Cats Together,multi-pet-household-tips,Pet Care,5,True,False
4574,Pet Hydration Guide: How Much Water Does Your Pet Need?,pet-hydration-guide,Pet Care,13,True,False
4571,Pet First Aid Basics: What Every Owner Should Know,pet-first-aid-basics,Pet Care,18,True,False
4568,Dog Dental Health: A Practical Care Guide,dog-dental-health-care-guide,Other,11,True,False
4566,Seasonal Dog Care: Keeping Your Dog Safe Year-Round,seasonal-dog-care-guide,Pet Care,11,True,False
4563,Dog Grooming Basics: A Complete Guide for Owners,dog-grooming-basics-guide,Dog Grooming,6,True,False
4415,Cat Toy Safety Guide: What Every Owner Should Know,cat-toy-safety-guide,Dog Toys,18,True,False
4406,Best Interactive Cat Toys for Indoor Cats: Engagement Guide,best-interactive-cat-toys-indoor-cats,Cat Supplies,22,True,False
4414,Harness vs Collar: Which Is Better for Your Dog?,harness-vs-collar-which-is-better,Dog Harnesses,6,True,False
4413,How to Measure Your Dog for a Harness: Step-by-Step Guide,how-to-measure-dog-for-harness,Dog Harnesses,6,True,False
4412,No-Pull Dog Harness Guide: How They Work and When to Use One,no-pull-dog-harness-guide,Dog Harnesses,6,True,False
4411,"Dog Harnesses: The Complete Guide to Types, Fitting, and Safety",dog-harnesses-complete-guide,Dog Harnesses,17,True,False
4410,Cat Enrichment Activities Beyond Toys: Complete Guide,cat-enrichment-activities-beyond-toys,Cat Toys,17,True,False
4409,Kitten vs Adult Cat Toys: Age-Appropriate Play Guide,kitten-vs-adult-cat-toys-age-appropriate,Cat Toys,20,True,False
4408,How Often Should You Replace Cat Toys? A Practical Guide,how-often-replace-cat-toys,Cat Toys,20,True,False
4407,DIY Cat Toys: Safe Homemade Options Your Cat Will Love,diy-cat-toys-safe-homemade-options,Cat Toys,20,False,False
4335,Best Cat Litter Disposal UK (2026) – Waste Management Guide,best-cat-litter-disposal-uk,Cat Supplies,18,True,False
4328,Best Self-Cleaning Litter Trays UK (2026) – Automatic Options,best-self-cleaning-litter-trays-uk,Other,12,False,False
4321,Best Cat Litter UK (2026) – Types & Comparison Guide,best-cat-litter-uk,Cat Supplies,18,True,False
4314,Best Cat Litter Trays UK (2026) – Complete Guide,best-cat-litter-trays-uk,Cat Supplies,18,True,False
4307,Best Wall-Mounted Cat Scratchers UK (2026) – Space Saving,best-wall-mounted-cat-scratchers-uk,Cat Supplies,15,False,False
4300,Best Cardboard Cat Scratchers UK (2026) – Budget Friendly,best-cardboard-cat-scratchers-uk,Cat Supplies,15,False,False
4293,Best Cat Trees UK (2026) – Climbing & Scratching Towers,best-cat-trees-uk,Cat Supplies,11,False,False
4286,Best Cat Scratching Posts UK (2026) – Complete Guide,best-cat-scratching-posts-uk,Cat Supplies,17,False,False
4279,Best Cat Harnesses UK (2026) – Safe Walking Guide,best-cat-harnesses-uk,Cat Supplies,10,False,False
4272,Best Cat ID Tags UK (2026) – Identification Guide,best-cat-id-tags-uk,Cat Supplies,17,False,False
4265,Best Cat GPS Trackers UK (2026) – Location Tracking Guide,best-cat-gps-trackers-uk,Cat Supplies,11,False,False
4258,Best Cat Collars UK (2026) – Complete Safety Guide,best-cat-collars-uk,Cat Supplies,10,False,False
4251,Best Cat Shampoo UK (2026) – When & How to Bathe,best-cat-shampoo-uk,Cat Supplies,13,True,False
4244,Best Cat Nail Clippers UK (2026) – Safe Trimming Guide,best-cat-nail-clippers-uk,Cat Supplies,12,True,False
4237,Best Cat Brushes UK (2026) – Guide by Coat Type,best-cat-brushes-uk,Dog Grooming,13,True,False
4230,Best Cat Grooming Supplies UK (2026) – Complete Guide,best-cat-grooming-supplies-uk,Cat Supplies,17,True,False
4223,Best Cat Window Perches UK (2026) – Sunning & Bird Watching,best-cat-window-perches-uk,Cat Supplies,14,True,False
4216,Best Cat Radiator Beds UK (2026) – Hook-On Warmth Guide,best-cat-radiator-beds-uk,Cat Supplies,14,True,False
4209,Best Heated Cat Beds UK (2026) – Winter Warmth Guide,best-heated-cat-beds-uk,Cat Supplies,14,False,False
4202,Best Cat Beds UK (2026) – Complete Guide,best-cat-beds-uk,Cat Supplies,14,False,False
4195,Best Cat Toys for Indoor Cats UK (2026) – Enrichment Guide,best-cat-toys-indoor-cats-uk,Cat Supplies,10,False,False
4188,Best Catnip Toys UK (2026) – What Works and Why,best-catnip-toys-uk,Cat Supplies,34,False,False
4181,Best Interactive Cat Toys UK (2026) – Wand & Puzzle Guide,best-interactive-cat-toys-uk,Cat Toys,28,False,False
4174,Best Cat Toys UK (2026) – Complete Guide,best-cat-toys-uk,Cat Toys,36,False,False
4167,Best Dog Water Bottles UK (2026) – Travel Hydration Guide,best-dog-water-bottles-uk,Other,23,True,False
4160,Best Elevated Dog Bowls UK (2026) – Raised Feeder Guide,best-elevated-dog-bowls-uk,Other,18,True,False
4153,Best Slow Feeder Dog Bowls UK (2026) – Prevent Speed Eating,best-slow-feeder-dog-bowls-uk,Other,12,True,False
4146,Best Dog Bowls and Feeding UK (2026) – Complete Guide,best-dog-bowls-feeding-uk,Other,13,True,False
4139,Best Dog Training Leads UK (2026) – Long Lines & Harnesses,best-dog-training-leads-uk,Dog Training,12,True,False
4132,Best Puppy Training Guide UK (2026) – First Year Essentials,best-puppy-training-guide-uk,Dog Training,11,True,False
4125,Best Dog Training Treats UK (2026) – Reward Guide,best-dog-training-treats-uk,Dog Training,8,True,False
4118,Best Dog Training and Behaviour UK (2026) – Complete Guide,best-dog-training-behaviour-uk,Dog Training,8,True,False
4110,Best Dog Joint Supplements UK (2026) – Mobility Support Guide,best-dog-joint-supplements-uk,Dog Health,14,True,False
4103,Best Dog Flea Treatment UK (2026) – Prevention Guide,best-dog-flea-treatment-uk,Dog Health,14,True,False
4096,Best Dog Dental Care UK (2026) – Teeth Cleaning Guide,best-dog-dental-care-uk,Dog Health,10,False,False
4089,Best Dog Health and Care UK (2026) – Complete Guide,best-dog-health-care-uk,Dog Health,14,True,False
4078,Best Dog Nail Clippers UK (2026) – Trimming & Grinding Guide,best-dog-nail-clippers-uk,Dog Grooming,11,False,False
4071,Best Dog Shampoo UK (2026) – Ingredients & Safety Guide,best-dog-shampoo-uk,Dog Grooming,13,False,False
4064,Best Dog Brushes UK (2026) – Guide by Coat Type,best-dog-brushes-uk,Dog Grooming,12,False,False
4057,Best Dog Grooming Supplies UK (2026) – Complete Guide,best-dog-grooming-supplies-uk,Dog Grooming,12,False,False
4049,Best Puppy Collars UK (2026) – First Collar & Harness Guide,best-puppy-collars-uk,Dog Harnesses,12,True,False
4042,Best Dog Leads UK (2026) – Walking & Training Lead Guide,best-dog-leads-uk,Dog Training,14,True,False
4034,Best No-Pull Dog Harnesses UK (2026) – Training & Comfort Guide,best-no-pull-dog-harnesses-uk,Dog Harnesses,14,True,False
4027,Best Dog Collars and Harnesses UK (2026) – Complete Guide,best-dog-collars-and-harnesses-uk,Dog Harnesses,14,True,False
4018,Best Puppy Beds UK (2026) – First Bed & Crate Training Guide,best-puppy-beds-uk,Dog Beds,13,True,False
4011,Best Cooling Dog Beds UK (2026) – Temperature Regulation Guide,best-cooling-dog-beds-uk,Dog Beds,7,True,False
4004,Best Orthopaedic Dog Beds UK (2026) – Joint Support Guide,best-orthopaedic-dog-beds-uk,Dog Beds,7,True,False
3996,Best Dog Beds UK (2026) – Complete Guide & Honest Reviews,best-dog-beds-uk,Dog Beds,16,True,False
3960,Best Puppy Toys UK (2026) – Teething & First Toys Guide,best-puppy-toys-uk,Other,16,True,False
3959,Best Interactive Dog Toys UK (2026) – Puzzle & Enrichment Guide,best-interactive-dog-toys-uk,Dog Toys,8,True,False
3957,Best Indestructible Dog Toys UK (2026) – Tough Toys for Heavy Chewers,best-indestructible-dog-toys-uk,Dog Toys,9,True,False
3956,Best Dog Toys UK (2026) – Complete Guide & Honest Reviews,best-dog-toys-uk,Dog Toys,15,True,False
3839,Best Puppy Food UK (2026) – Growth-Stage Nutrition Guide,best-puppy-food-uk,Dog Food,17,True,False
3838,Dry vs Wet Dog Food UK – An Honest Comparison Guide,dry-vs-wet-dog-food-uk,Dog Food,17,True,False
3837,Best Dry Dog Food UK (2026) – Evidence-Based Guide,best-dry-dog-food-uk,Dog Food,17,True,False
3836,Best Dog Food UK (2026) – Complete Buying Guide,best-dog-food-uk,Dog Food,14,True,False
696,Essential Cat Supplies for Cat Owners – Number 1 Must-Haves,essential-cat-supplies-for-cat-owners,Cat Supplies,10,False,False
3,Dog Toys UK (2026) – Essential Guide for Pet Owners,top-dog-toys-every-pet-owner-needs-in-2026,Dog Toys,158,False,False
