anchor_text,target_url,usage_count,diversity_status
indoor cat care: a complete guide to keeping house cats happy and healthy,https://pethubonline.com/indoor-cat-care-guide,3,warning
catio kits uk: complete guide,https://pethubonline.com/,3,warning
diy catio plans: guide,https://pethubonline.com/,3,warning
indoor cat exercise: daily routines to keep cats active,https://pethubonline.com/,3,warning
indoor cat enrichment,https://pethubonline.com/indoor-cat-behaviour-common-issues,3,warning
indoor cat enrichment,https://pethubonline.com/indoor-cat-exercise-guide,1,ok
indoor cat enrichment,https://pethubonline.com/best-cat-toys-indoor-cats-uk,1,ok
keeping indoor cats happy,https://pethubonline.com/indoor-cat-diet-nutrition-guide,3,warning
keeping indoor cats happy,https://pethubonline.com/indoor-cat-safety-household-hazards,1,ok
indoor cat care: a complete,https://pethubonline.com/indoor-cat-care-guide,3,warning
catio kits uk: complete guide to outdoor cat enclosures,https://pethubonline.com/,3,warning
diy catio plans: how to build a cat enclosure in the uk,https://pethubonline.com/,3,warning
indoor cat exercise: daily routines to keep uk cats active,https://pethubonline.com/,3,warning
indoor cat diet and nutrition: feeding guidelines for house cats,https://pethubonline.com/indoor-cat-diet-nutrition-guide,3,warning
diy catio plans: how to,https://pethubonline.com/,3,warning
indoor cat exercise: guide,https://pethubonline.com/,3,warning
indoor cat diet and nutrition: feeding tipslines for house cats,https://pethubonline.com/indoor-cat-diet-nutrition-guide,3,warning
catio kits uk: guide,https://pethubonline.com/,3,warning
indoor cat behaviour: understanding and managing common issues,https://pethubonline.com/indoor-cat-behaviour-common-issues,1,ok
pet first aid basics: what every owner should know,https://pethubonline.com/pet-first-aid-basics,3,warning
multi-pet household management: uk guide,https://pethubonline.com/,3,warning
seasonal pet care guide,https://pethubonline.com/,3,warning
first-time pet owner : complete beginner guide,https://pethubonline.com/,3,warning
essential pet care tips,https://pethubonline.com/puppy-teething-guide-stages-signs,3,warning
essential pet care tips,https://pethubonline.com/first-week-new-puppy-guide,3,warning
essential pet care tips,https://pethubonline.com/pet-first-aid-basics,3,warning
essential pet care tips,https://pethubonline.com/,3,warning
essential pet care tips,https://pethubonline.com/cat-supply-essentials-glossary-understanding-cat-care-products,1,ok
essential pet care tips,https://pethubonline.com/best-cat-brushes-uk,1,ok
pet first aid basics: what,https://pethubonline.com/pet-first-aid-basics,3,warning
multi-pet household management: uk guide for harmony,https://pethubonline.com/,3,warning
seasonal pet care calendar uk: monthly guide for pet owners,https://pethubonline.com/,3,warning
first-time pet owner uk: complete beginner guide,https://pethubonline.com/,3,warning
first week with a new puppy: a day-by-day guide,https://pethubonline.com/first-week-new-puppy-guide,3,warning
pet first aid guide,https://pethubonline.com/pet-first-aid-basics,3,warning
multi-pet household management: guide,https://pethubonline.com/,3,warning
seasonal pet care calendar uk:,https://pethubonline.com/,3,warning
first-time pet owner uk: complete,https://pethubonline.com/,3,warning
first week with a new,https://pethubonline.com/first-week-new-puppy-guide,3,warning
multi-pet household management: guide for harmony,https://pethubonline.com/,3,warning
seasonal pet care calendar : monthly guide for pet owners,https://pethubonline.com/,3,warning
first-time pet owner guide,https://pethubonline.com/,3,warning
first week with guide,https://pethubonline.com/first-week-new-puppy-guide,3,warning
pet ownership guide,https://pethubonline.com/pet-first-aid-basics,3,warning
pet ownership guide,https://pethubonline.com/,3,warning
pet ownership guide,https://pethubonline.com/first-week-new-puppy-guide,3,warning
pet ownership guide,https://pethubonline.com/puppy-teething-guide-stages-signs,3,warning
pet ownership guide,https://pethubonline.com/dog-bed-safety-non-toxic-materials,1,ok
pet ownership guide,https://pethubonline.com/dog-health-terminology-understanding-common-veterinary-and-care-terms,1,ok
pet ownership guide,https://pethubonline.com/best-wall-mounted-cat-scratchers-uk,1,ok
pet ownership guide,https://pethubonline.com/best-cat-scratching-posts-uk,1,ok
pet ownership guide,https://pethubonline.com/best-cat-grooming-supplies-uk,1,ok
pet ownership guide,https://pethubonline.com/best-slow-feeder-dog-bowls-uk,1,ok
multi-pet household management: uk tips for harmony,https://pethubonline.com/,3,warning
seasonal pet care calendar uk: monthly tips for pet owners,https://pethubonline.com/,3,warning
first-time pet owner uk: complete beginner tips,https://pethubonline.com/,3,warning
first week with a new puppy: a day-by-day tips,https://pethubonline.com/first-week-new-puppy-guide,3,warning
caring for your pet,https://pethubonline.com/,3,warning
caring for your pet,https://pethubonline.com/first-week-new-puppy-guide,3,warning
caring for your pet,https://pethubonline.com/pet-first-aid-basics,3,warning
caring for your pet,https://pethubonline.com/puppy-teething-guide-stages-signs,2,ok
caring for your pet,https://pethubonline.com/seasonal-dog-bedding-guide,1,ok
caring for your pet,https://pethubonline.com/cat-care-basics-glossary,1,ok
caring for your pet,https://pethubonline.com/best-cat-litter-disposal-uk,1,ok
caring for your pet,https://pethubonline.com/best-cardboard-cat-scratchers-uk,1,ok
caring for your pet,https://pethubonline.com/best-cat-harnesses-uk,1,ok
caring for your pet,https://pethubonline.com/best-dog-water-bottles-uk,1,ok
"puppy teething guide: stages, signs, and soothing tips",https://pethubonline.com/puppy-teething-guide-stages-signs,3,warning
"puppy teething guide: stages, signs,",https://pethubonline.com/puppy-teething-guide-stages-signs,3,warning
puppy teething guide: guide,https://pethubonline.com/puppy-teething-guide-stages-signs,3,warning
"puppy teething tips: stages, signs, and soothing tips",https://pethubonline.com/puppy-teething-guide-stages-signs,3,warning
best cat toys uk (2026) – complete guide,https://pethubonline.com/best-cat-toys-uk,3,warning
diy cat toys from household,https://pethubonline.com/,3,warning
cat puzzle feeders guide,https://pethubonline.com/,3,warning
interactive cat toys for solo play : keep cats busy,https://pethubonline.com/,3,warning
engaging cat activities,https://pethubonline.com/cat-toy-types-glossary,3,warning
engaging cat activities,https://pethubonline.com/,3,warning
engaging cat activities,https://pethubonline.com/cat-toy-terminology-understanding-play-types-and-toy-features,3,warning
engaging cat activities,https://pethubonline.com/how-often-replace-cat-toys,1,ok
diy cat toys from household items: easy projects,https://pethubonline.com/,3,warning
cat puzzle feeders uk: guide,https://pethubonline.com/,3,warning
interactive cat toys guide,https://pethubonline.com/,3,warning
best cat toys,https://pethubonline.com/cat-toy-terminology-understanding-play-types-and-toy-features,3,warning
best cat toys,https://pethubonline.com/how-to-choose-cat-toys-personality,1,ok
best cat toys,https://pethubonline.com/cat-toy-safety-guide,2,ok
best cat toys,https://pethubonline.com/,3,warning
best cat toys,https://pethubonline.com/kitten-vs-adult-cat-toys-age-appropriate,1,ok
cat puzzle feeders uk: guide to food puzzles for cats,https://pethubonline.com/,3,warning
interactive cat toys for solo play uk: keep cats busy,https://pethubonline.com/,3,warning
cat toy terminology: understanding play types and toy features,https://pethubonline.com/cat-toy-terminology-understanding-play-types-and-toy-features,3,warning
cat toy types explained: a complete glossary,https://pethubonline.com/cat-toy-types-glossary,3,warning
diy cat toys guide,https://pethubonline.com/,3,warning
interactive cat toys for solo,https://pethubonline.com/,3,warning
cat toy terminology: understanding play,https://pethubonline.com/cat-toy-terminology-understanding-play-types-and-toy-features,3,warning
cat toy types explained: a,https://pethubonline.com/cat-toy-types-glossary,3,warning
cat puzzle feeders : guide to food puzzles for cats,https://pethubonline.com/,3,warning
cat toy terminology: guide,https://pethubonline.com/cat-toy-terminology-understanding-play-types-and-toy-features,3,warning
cat toy types guide,https://pethubonline.com/cat-toy-types-glossary,2,ok
cat puzzle feeders uk: tips to food puzzles for cats,https://pethubonline.com/,3,warning
cat playtime essentials,https://pethubonline.com/,3,warning
cat playtime essentials,https://pethubonline.com/cat-toy-terminology-understanding-play-types-and-toy-features,1,ok
dog toys uk (2026) – essential guide for pet owners,https://pethubonline.com/top-dog-toys-every-pet-owner-needs-in-2026,3,warning
dog coats and jackets uk:,https://pethubonline.com/,3,warning
dog travel accessories guide,https://pethubonline.com/,3,warning
dog feeding station setup: complete guide for owners,https://pethubonline.com/,3,warning
dog accessories guide,https://pethubonline.com/dog-food-glossary-understanding-ingredients-and-nutrition-labels,3,warning
dog accessories guide,https://pethubonline.com/dog-bed-terminology-materials-types-and-sizing-terms-explained,3,warning
dog accessories guide,https://pethubonline.com/,3,warning
dog accessories guide,https://pethubonline.com/top-dog-toys-every-pet-owner-needs-in-2026,3,warning
dog toys uk (2026) –,https://pethubonline.com/top-dog-toys-every-pet-owner-needs-in-2026,3,warning
dog coats and jackets uk: choosing the right one,https://pethubonline.com/,3,warning
dog travel accessories uk: essential gear for uk trips,https://pethubonline.com/,3,warning
dog feeding station setup: complete guide for uk owners,https://pethubonline.com/,3,warning
"dog bed terminology: materials, types, and sizing terms explained",https://pethubonline.com/dog-bed-terminology-materials-types-and-sizing-terms-explained,3,warning
dog toys uk guide,https://pethubonline.com/top-dog-toys-every-pet-owner-needs-in-2026,3,warning
dog coats and guide,https://pethubonline.com/,3,warning
dog travel accessories uk: essential,https://pethubonline.com/,3,warning
dog feeding station setup: complete,https://pethubonline.com/,3,warning
"dog bed terminology: materials, types,",https://pethubonline.com/dog-bed-terminology-materials-types-and-sizing-terms-explained,3,warning
dog toys (2026) – essential guide for pet owners,https://pethubonline.com/top-dog-toys-every-pet-owner-needs-in-2026,3,warning
dog coats and jackets : choosing the right one,https://pethubonline.com/,3,warning
dog travel accessories : essential gear for trips,https://pethubonline.com/,3,warning
dog feeding station guide,https://pethubonline.com/,3,warning
dog bed terminology: guide,https://pethubonline.com/dog-bed-terminology-materials-types-and-sizing-terms-explained,3,warning
dog toys uk (2026) – essential tips for pet owners,https://pethubonline.com/top-dog-toys-every-pet-owner-needs-in-2026,3,warning
essential dog gear,https://pethubonline.com/,3,warning
essential dog gear,https://pethubonline.com/dog-bed-terminology-materials-types-and-sizing-terms-explained,3,warning
essential dog gear,https://pethubonline.com/top-dog-toys-every-pet-owner-needs-in-2026,3,warning
dog feeding station setup: complete tips for uk owners,https://pethubonline.com/,3,warning
supplies for your dog,https://pethubonline.com/,3,warning
supplies for your dog,https://pethubonline.com/dog-bed-terminology-materials-types-and-sizing-terms-explained,3,warning
supplies for your dog,https://pethubonline.com/top-dog-toys-every-pet-owner-needs-in-2026,3,warning
indoor cat behaviour: understanding and,https://pethubonline.com/indoor-cat-behaviour-common-issues,1,ok
creating a cat-friendly guide,https://pethubonline.com/cat-friendly-home-enrichment-indoor-cats,1,ok
cat indoor living tips,https://pethubonline.com/indoor-cat-terminology-a-complete-glossary-for-cat-owners,1,ok
cat indoor living tips,https://pethubonline.com/,1,ok
diy catio plans: how to build a cat enclosure in the,https://pethubonline.com/,1,ok
indoor cat exercise: daily routines,https://pethubonline.com/,1,ok
cat toy safety guide: what,https://pethubonline.com/cat-toy-safety-guide,1,ok
best interactive cat guide,https://pethubonline.com/best-interactive-cat-toys-indoor-cats,1,ok
cat enrichment activities beyond toys: complete tips,https://pethubonline.com/cat-enrichment-activities-beyond-toys,1,ok
diy cat toys: safe homemade options your cat will love,https://pethubonline.com/diy-cat-toys-safe-homemade-options,1,ok
best catnip toys uk (2026) – what works and why,https://pethubonline.com/best-catnip-toys-uk,1,ok
best interactive cat toys uk (2026) – wand &#038; puzzle guide,https://pethubonline.com/best-interactive-cat-toys-uk,1,ok
puppy sleep guide: guide,https://pethubonline.com/puppy-sleep-guide-by-age,1,ok
puppy-proofing your home: a room-by-room safety tips,https://pethubonline.com/puppy-proofing-home-safety-guide,1,ok
puppy bed training: helping your dog love their bed,https://pethubonline.com/puppy-bed-training-guide,1,ok
dog bed placement guide: where to put your dog’s bed,https://pethubonline.com/dog-bed-placement-guide,1,ok
how to wash and dry,https://pethubonline.com/how-to-wash-dog-bed-safely,1,ok
seasonal pet safety: protecting pets through the year,https://pethubonline.com/seasonal-pet-safety-guide,1,ok
multi-pet household tips: living with,https://pethubonline.com/multi-pet-household-tips,1,ok
pet hydration guide: how much water does your pet need?,https://pethubonline.com/pet-hydration-guide,1,ok
best self-cleaning litter guide,https://pethubonline.com/best-self-cleaning-litter-trays-uk,1,ok
best cat litter uk (2026),https://pethubonline.com/best-cat-litter-uk,1,ok
best cat litter guide,https://pethubonline.com/best-cat-litter-trays-uk,1,ok
best cat trees uk (2026) – climbing &#038; scratching towers,https://pethubonline.com/best-cat-trees-uk,1,ok
best cat id tags uk (2026) – identification guide,https://pethubonline.com/best-cat-id-tags-uk,1,ok
best cat gps trackers uk,https://pethubonline.com/best-cat-gps-trackers-uk,1,ok
best cat collars guide,https://pethubonline.com/best-cat-collars-uk,1,ok
best cat shampoo (2026) – when &#038; how to bathe,https://pethubonline.com/best-cat-shampoo-uk,1,ok
best cat nail clippers uk (2026) – safe trimming tips,https://pethubonline.com/best-cat-nail-clippers-uk,1,ok
best elevated dog bowls uk (2026) – raised feeder guide,https://pethubonline.com/best-elevated-dog-bowls-uk,1,ok
best dog bowls guide,https://pethubonline.com/best-dog-bowls-feeding-uk,1,ok
dog food glossary: understanding ingredients,https://pethubonline.com/dog-food-glossary-understanding-ingredients-and-nutrition-labels,1,ok
puppy care glossary: guide,https://pethubonline.com/puppy-care-glossary-essential-terms-for-new-puppy-owners,1,ok
