post_id,title,cluster,trust_links,has_faq,has_glossary,has_comparison,snippet_h2_pct,total_h2s,question_h2s,has_quick_answer,has_sources,internal_links,word_count,authority_density
8172,Our Research Standards,Uncategorized,100.0,100,100,100,0.0,11,0,100,100,7,2699,82.0
8171,Why PetHub Online Exists,Uncategorized,100.0,100,100,100,0.0,8,0,100,100,6,2339,81.0
7346,Indoor Cat Diet and Nutrition: Feeding Guidelines for House Cats,Indoor Cats,100.0,100,100,100,0.0,12,0,100,100,16,2674,85.0
7345,Indoor Cat Behaviour: Understanding and Managing Common Issues,Indoor Cats,100.0,100,100,100,0.0,12,0,100,100,16,2593,85.0
7344,Creating a Cat-Friendly Home: Environmental Enrichment for Indoor Cats,Indoor Cats,100.0,100,100,100,8.3,12,1,100,100,16,2574,86.2
7343,Indoor Cat Safety: Common Household Hazards for Cats,Indoor Cats,100.0,100,100,100,0.0,13,0,100,100,16,2706,85.0
7342,Indoor Cat Exercise: Keeping House Cats Active and Healthy,Indoor Cats,100.0,100,100,100,8.3,12,1,100,100,16,2671,86.2
7341,First Week with a New Puppy: A Day-by-Day Guide,Dog Care,100.0,100,100,100,0.0,11,0,0,100,20,3920,80.0
7340,"Puppy Teething Guide: Stages, Signs, and Soothing Tips",Dog Health,100.0,100,100,100,0.0,11,0,0,100,20,3666,80.0
7339,Puppy Sleep Guide: How Much Sleep Puppies Need by Age,Dog Care,100.0,100,100,100,0.0,10,0,0,100,20,3596,80.0
7338,Puppy-Proofing Your Home: A Room-by-Room Safety Guide,Dog Care,100.0,100,100,100,0.0,9,0,0,100,20,3516,80.0
7337,Puppy Vaccination Schedule UK: What to Expect and When,Dog Health,100.0,100,100,100,0.0,12,0,0,100,11,4175,80.0
7336,Dog Bed Safety: Avoiding Hazards and Choosing Non-Toxic Materials,Dog Beds,100.0,100,100,100,0.0,12,0,0,100,17,3565,80.0
7335,Seasonal Dog Bedding: Adjusting Comfort Through the Year,Dog Beds,100.0,100,100,100,0.0,10,0,0,100,17,3210,80.0
7334,Puppy Bed Training: Helping Your Dog Love Their Bed,Dog Beds,100.0,100,100,100,0.0,11,0,0,100,19,3933,80.0
7333,Dog Bed Placement Guide: Where to Put Your Dog’s Bed,Dog Beds,100.0,100,100,100,0.0,11,0,0,100,17,3681,80.0
7332,How to Wash and Dry a Dog Bed Safely,Dog Beds,100.0,100,100,100,7.7,13,1,0,100,18,3732,81.2
7177,Cat Toy Terminology: Understanding Play Types and Toy Features,Cat Supplies,100.0,100,100,100,0.0,7,0,100,100,14,4288,85.0
7175,Cat Supply Essentials Glossary: Understanding Cat Care Products,Cat Supplies,100.0,100,100,100,0.0,7,0,100,100,18,4149,85.0
7174,"Dog Bed Terminology: Materials, Types, and Sizing Terms Explained",Dog Beds,100.0,100,100,100,0.0,7,0,100,100,14,4573,85.0
7172,Dog Food Glossary: Understanding Ingredients and Nutrition Labels,Dog Food,100.0,100,100,50,0.0,5,0,0,100,7,4870,69.5
7170,Dog Health Terminology: Understanding Common Veterinary and Care Terms,Dog Health,100.0,100,100,100,0.0,7,0,0,100,18,4372,80.0
7169,Puppy Care Glossary: Essential Terms for New Puppy Owners,Dog Care,100.0,100,100,100,0.0,7,0,0,100,14,4525,80.0
7167,Indoor Cat Terminology: A Complete Glossary for Cat Owners,Cat Supplies,100.0,100,100,100,0.0,7,0,100,100,12,4409,85.0
6052,Low-Mobility Enrichment: Mental Stimulation for Dogs with Limited Movement,Uncategorized,100.0,100,100,100,0.0,9,0,100,100,10,3496,85.0
6050,Toy Overstimulation Recovery: Calming Down an Overexcited Dog,Uncategorized,100.0,100,100,100,25.0,8,2,100,100,11,3276,88.8
6049,Sensory Enrichment for Dogs: Engaging All Five Senses Through Play,Uncategorized,100.0,100,100,100,0.0,8,0,100,100,10,3343,85.0
6048,Confidence-Building Play: Helping Shy and Fearful Dogs Through Toys,Uncategorized,100.0,100,100,100,22.2,9,2,100,100,9,3212,87.3
6047,Play Recovery After Surgery: Gentle Enrichment for Healing Dogs,Uncategorized,100.0,100,100,100,12.5,8,1,100,100,10,3296,86.9
6046,Dog Toy Hygiene Schedules: A Practical Cleaning Timetable,Uncategorized,100.0,100,100,100,0.0,8,0,100,100,11,3343,85.0
6045,Safe Multi-Dog Toy Management: Preventing Resource Guarding,Uncategorized,100.0,100,100,100,12.5,8,1,100,100,10,3301,86.9
6044,Rotating Puzzle Complexity: Progressive Challenge for Smart Dogs,Uncategorized,100.0,100,100,100,10.0,10,1,100,100,9,3193,85.5
6042,Enrichment by Breed Group: Tailoring Play to Your Dog's Instincts,Uncategorized,100.0,100,100,100,20.0,5,1,100,100,12,3230,88.0
6039,Dog Toy Anxiety Reduction: Using Toys to Calm Nervous Dogs,Uncategorized,100.0,100,100,100,22.2,9,2,100,100,9,3421,87.3
5950,Dog Toy Durability Guide: What Lasts and What Does Not,Uncategorized,100.0,100,100,100,7.7,13,1,100,100,14,3725,86.2
5946,"Dog Toy Materials Compared: Rubber, Rope, Plush, and Nylon",Uncategorized,100.0,100,100,100,9.1,11,1,100,100,12,3480,86.4
5942,Cognitive Enrichment for Senior Dogs: Gentle Play for Ageing Minds,Uncategorized,100.0,100,100,100,0.0,13,0,100,100,10,3501,85.0
5938,Enrichment Schedules for Dogs: Structuring Daily Play and Mental Work,Uncategorized,100.0,100,100,100,9.1,11,1,100,100,13,3417,86.4
5935,Dog Toy Storage and Organisation: Keeping Toys Clean and Accessible,Uncategorized,100.0,100,100,100,9.1,11,1,100,100,12,3209,86.4
5934,Crate and Play Enrichment: Keeping Dogs Happy in Confined Spaces,Uncategorized,100.0,100,100,100,0.0,7,0,0,100,6,2957,76.0
5933,"Safe Tug Play with Dogs: Rules, Benefits, and Common Mistakes",Uncategorized,100.0,100,100,100,33.3,9,3,100,100,5,2963,85.0
5932,Scent-Game Enrichment for Dogs: Using Smell to Engage Your Dog,Uncategorized,100.0,100,100,100,0.0,6,0,100,100,5,3290,80.0
5931,Signs of Toy Overstimulation in Dogs: When Play Becomes Too Much,Uncategorized,100.0,100,100,100,11.1,9,1,100,100,5,3459,81.7
5930,Dog Toy Safety by Breed Size: Choosing the Right Size Toy,Uncategorized,100.0,100,100,100,0.0,6,0,100,100,5,3231,80.0
5523,"Dog Training Equipment Explained: Tools, Uses, and What to Avoid",Uncategorized,100.0,100,100,100,0.0,11,0,100,100,19,6134,85.0
5522,"Orthopaedic Care for Dogs: Joint Health, Mobility, and Support",Uncategorized,100.0,100,100,100,28.6,14,4,100,100,15,6912,89.3
5521,Pet Health Terminology: A Guide to Common Veterinary Terms,Uncategorized,100.0,100,100,100,0.0,10,0,100,100,9,5229,84.0
5520,"Dog Health Basics: Common Conditions, Prevention, and When to See a Vet",Uncategorized,100.0,100,100,100,7.1,14,1,100,100,16,5820,86.1
5519,Indoor Cat Care: A Complete Guide to Keeping House Cats Happy and Healthy,Uncategorized,100.0,100,100,100,7.1,14,1,100,100,20,7044,86.1
5512,Dog Behaviour Explained: Understanding Your Dog's Body Language and Actions,Uncategorized,100.0,100,100,100,9.1,11,1,100,100,20,5332,86.4
5511,"Pet Enrichment Explained: Types, Benefits, and Practical Ideas",Uncategorized,100.0,100,100,100,0.0,12,0,100,100,8,6003,83.0
5510,Dog Bed Sizing Guide: How to Measure Your Dog and Choose the Right Fit,Uncategorized,100.0,100,100,100,0.0,13,0,100,100,11,6644,85.0
5509,"Pet Toy Safety: Understanding Materials, Hazards, and Standards",Uncategorized,100.0,100,100,100,25.0,12,3,100,100,10,6261,88.8
5508,Puppy Development Stages: A Complete Guide from Birth to Maturity,Uncategorized,100.0,100,100,100,0.0,10,0,100,100,19,5578,85.0
5483,Dog Toy Lifespan: When to Replace Toys and How to Extend Their Life,Uncategorized,100.0,100,100,100,0.0,11,0,100,100,11,5189,85.0
5476,"Mental Stimulation Toys for Dogs: Puzzles, Games, and Brain Work",Uncategorized,100.0,100,100,100,7.7,13,1,100,100,13,5122,86.2
5473,Senior Dog Toys: Gentle Play Options for Older Dogs,Uncategorized,100.0,100,100,100,7.1,14,1,100,100,7,5274,83.1
5471,"Dog Boredom Prevention: Signs, Solutions, and Enrichment Ideas",Uncategorized,100.0,100,100,100,7.1,14,1,100,100,8,4922,84.1
5469,Dog Toy Rotation: How to Keep Your Dog Interested and Engaged,Uncategorized,100.0,100,100,100,7.7,13,1,100,100,9,4924,85.2
5467,"Pet Feeding Guide: Understanding Portions, Schedules, and Methods",Uncategorized,100.0,100,100,100,0.0,13,0,100,100,12,6789,85.0
5464,Pet Grooming Glossary: Understanding Grooming Terms and Techniques,Uncategorized,100.0,100,100,100,18.2,11,2,100,100,10,5839,87.7
5462,Dog Training Terminology Explained: Key Concepts for New Owners,Uncategorized,100.0,100,100,100,20.0,10,2,100,100,11,4770,88.0
5460,Pet Nutrition Terminology: A Guide to Common Terms on Pet Food Labels,Uncategorized,100.0,100,100,100,10.0,10,1,100,100,12,6241,86.5
5458,Cat Scratching Behaviour Explained: Why Cats Scratch and How to Help,Uncategorized,100.0,100,100,100,33.3,12,4,100,100,15,5613,90.0
5425,Dog Toys FAQ: Common Questions Answered,Dog Supplies,100.0,100,100,100,68.8,16,11,100,100,18,5216,95.3
5424,Aggressive Chewer Guide: Safe Toys for Power Chewers,Dog Supplies,100.0,100,100,100,9.1,11,1,100,100,15,4169,86.4
5423,Dog Toy Enrichment: Beyond Basic Fetch,Dog Supplies,100.0,100,100,100,0.0,12,0,100,100,14,4188,85.0
5422,Indoor vs Outdoor Dog Toys: Choosing the Right Type,Dog Supplies,100.0,100,100,100,18.2,11,2,100,100,16,4484,87.7
5421,Puppy-Safe Dog Toys: What to Look For and What to Avoid,Dog Supplies,100.0,100,100,100,8.3,12,1,100,100,12,4473,86.2
5420,Dog Toy Cleaning Guide: How to Keep Toys Hygienic,Dog Supplies,100.0,100,100,100,7.7,13,1,100,100,12,4059,86.2
5419,Cat Care Basics: A Glossary for New Cat Owners,Cat Supplies,100.0,100,100,100,0.0,7,0,100,100,6,4285,81.0
5418,Dog Harness Types Explained: Finding the Right Fit,Dog Harnesses,100.0,100,100,50,0.0,5,0,100,100,9,4821,76.5
5417,Puppy Care Essentials: Key Terms Every New Owner Should Know,Dog Care,100.0,100,100,50,0.0,6,0,100,100,20,5512,77.5
5416,Dog Bed Types Explained: A Complete Glossary,Dog Beds,100.0,100,100,100,0.0,6,0,100,100,11,4531,85.0
5415,Dog Play Styles Explained: Understanding How Your Dog Plays,Uncategorized,100.0,100,100,100,0.0,8,0,100,100,13,3147,85.0
5414,Cat Toy Types Explained: A Complete Glossary,Uncategorized,100.0,100,100,100,0.0,10,0,100,100,11,3708,85.0
5296,Best Indoor Cat Toys UK (2026): Complete Guide for House Cats,Uncategorized,100.0,100,100,100,0.0,9,0,100,100,18,4895,85.0
5033,How to Choose the Right Cat Toy for Your Cat's Personality,Cat Toys,100.0,100,100,100,10.0,10,1,100,100,20,3650,86.5
5036,Understanding Cat Play Behaviour: What Different Play Styles Mean,Cat Toys,100.0,100,100,100,10.0,10,1,100,100,17,3290,86.5
5032,Cat Toys FAQ: Common Questions Answered,Cat Toys,100.0,100,100,100,66.7,12,8,100,100,20,3986,95.0
5035,Cat Enrichment Beyond Toys: Creating a Stimulating Home,Cat Toys,100.0,100,100,100,0.0,10,0,100,100,13,3886,85.0
5034,Cat Toy Rotation: How to Keep Toys Fresh and Engaging,Cat Toys,100.0,100,100,100,10.0,10,1,100,100,12,3778,86.5
4792,Puppy Socialisation: A Complete Timeline Guide,Dog Supplies,100.0,100,100,100,7.7,13,1,100,100,20,4490,86.2
4791,How to Choose the Right Dog Training Treats,Dog Supplies,100.0,100,100,100,0.0,13,0,100,100,18,3701,85.0
4790,DIY Dog Toys: Safe Homemade Options,Dog Supplies,100.0,100,100,100,0.0,12,0,100,100,11,3345,85.0
4789,Best Types of Dog Toys for Different Play Styles,Dog Supplies,100.0,100,100,100,0.0,13,0,100,100,11,3513,85.0
4788,Mental Stimulation for Dogs: Beyond Physical Exercise,Dog Supplies,100.0,100,100,100,15.4,13,2,100,100,9,3659,86.3
4787,Dog Toy Safety: What Every Owner Needs to Know,Dog Supplies,100.0,100,100,100,23.1,13,3,100,100,11,3321,88.5
4786,Where to Place Your Dog's Bed: Location and Comfort Tips,Dog Beds,100.0,100,100,100,7.7,13,1,100,100,12,3809,86.2
4785,How to Wash and Maintain Your Dog's Bed,Dog Beds,100.0,100,100,100,0.0,13,0,100,100,12,3755,85.0
4784,"Dog Bed Materials Explained: Foam, Memory Foam, and More",Dog Beds,100.0,100,100,100,7.7,13,1,0,100,15,4026,81.2
4783,How to Choose the Right Dog Bed Size,Dog Beds,100.0,100,100,100,0.0,12,0,100,100,8,3767,83.0
4573,Seasonal Pet Safety: Protecting Pets Through the Year,Pet Care,100.0,100,100,100,44.4,9,4,100,100,9,2666,90.7
4570,First-Time Dog Owner Essentials: What You Need to Know,Dog Care,100.0,100,100,100,11.1,9,1,100,100,16,4187,86.7
4576,Multi-Pet Household Tips: Living with Dogs and Cats Together,Pet Care,100.0,100,100,100,33.3,9,3,100,100,5,2581,85.0
4574,Pet Hydration Guide: How Much Water Does Your Pet Need?,Dog Supplies,100.0,100,100,100,33.3,9,3,0,100,13,3571,85.0
4571,Pet First Aid Basics: What Every Owner Should Know,Dog Supplies,100.0,100,100,100,12.5,8,1,0,100,18,3082,81.9
4568,Dog Dental Health: A Practical Care Guide,Dog Care,100.0,100,100,100,22.2,9,2,100,100,11,4208,88.3
4566,Seasonal Dog Care: Keeping Your Dog Safe Year-Round,Dog Care,100.0,100,100,100,14.3,7,1,100,100,11,3581,87.1
4563,Dog Grooming Basics: A Complete Guide for Owners,Dog Care,100.0,0,100,100,0.0,2,0,100,100,6,3161,66.0
4415,Cat Toy Safety Guide: What Every Owner Should Know,Cat Supplies,100.0,100,100,100,22.2,9,2,100,100,18,3627,88.3
4406,Best Interactive Cat Toys for Indoor Cats: Engagement Guide,Cat Supplies,100.0,100,100,100,12.5,8,1,100,100,20,3747,86.9
4414,Harness vs Collar: Which Is Better for Your Dog?,Dog Care,100.0,100,100,50,0.0,2,0,100,100,6,3434,73.5
4413,How to Measure Your Dog for a Harness: Step-by-Step Guide,Dog Care,100.0,100,100,50,0.0,2,0,100,100,6,3063,73.5
4412,No-Pull Dog Harness Guide: How They Work and When to Use One,Dog Harnesses,100.0,100,100,50,0.0,2,0,100,100,6,3109,73.5
4411,"Dog Harnesses: The Complete Guide to Types, Fitting, and Safety",Dog Care,100.0,100,100,50,12.5,8,1,100,100,20,3777,79.4
4410,Cat Enrichment Activities Beyond Toys: Complete Guide,Cat Supplies,100.0,100,100,100,22.2,9,2,100,100,17,3021,88.3
4409,Kitten vs Adult Cat Toys: Age-Appropriate Play Guide,Cat Supplies,100.0,100,100,100,12.5,8,1,100,100,20,3507,86.9
4408,How Often Should You Replace Cat Toys? A Practical Guide,Cat Supplies,100.0,100,100,100,12.5,8,1,100,100,20,3668,86.9
4407,DIY Cat Toys: Safe Homemade Options Your Cat Will Love,Cat Supplies,100.0,100,100,100,14.3,7,1,100,100,20,3844,87.1
4335,Best Cat Litter Disposal UK (2026) – Waste Management Guide,Cat Supplies,100.0,100,100,100,7.1,14,1,100,100,18,4135,86.1
4328,Best Self-Cleaning Litter Trays UK (2026) – Automatic Options,Cat Supplies,100.0,100,100,100,23.1,13,3,100,100,12,3701,88.5
4321,Best Cat Litter UK (2026) – Types &#038; Comparison Guide,Cat Supplies,100.0,100,100,100,16.7,12,2,100,100,18,4159,87.5
4314,Best Cat Litter Trays UK (2026) – Complete Guide,Cat Supplies,100.0,100,100,100,26.7,15,4,100,100,18,4466,89.0
4307,Best Wall-Mounted Cat Scratchers UK (2026) – Space Saving,Cat Supplies,100.0,100,100,100,23.1,13,3,100,100,15,3796,88.5
4300,Best Cardboard Cat Scratchers UK (2026) – Budget Friendly,Cat Supplies,100.0,100,100,100,23.1,13,3,100,100,15,3773,88.5
4293,Best Cat Trees UK (2026) – Climbing & Scratching Towers,Cat Supplies,100.0,100,100,100,15.4,13,2,100,100,11,3517,87.3
4286,Best Cat Scratching Posts UK (2026) – Complete Guide,Cat Supplies,100.0,100,100,100,21.4,14,3,100,100,17,4232,88.2
4279,Best Cat Harnesses UK (2026) – Safe Walking Guide,Cat Supplies,100.0,100,100,100,15.4,13,2,100,100,10,3616,87.3
4272,Best Cat ID Tags UK (2026) – Identification Guide,Cat Supplies,100.0,100,100,100,15.4,13,2,100,100,17,3718,87.3
4265,Best Cat GPS Trackers UK (2026) – Location Tracking Guide,Cat Supplies,100.0,100,100,100,15.4,13,2,100,100,11,3512,87.3
4258,Best Cat Collars UK (2026) – Complete Safety Guide,Cat Supplies,100.0,100,100,100,14.3,14,2,100,100,10,3755,87.1
4251,Best Cat Shampoo UK (2026) – When & How to Bathe,Cat Supplies,100.0,100,100,100,30.0,10,3,100,100,13,3250,89.5
4244,Best Cat Nail Clippers UK (2026) – Safe Trimming Guide,Cat Supplies,100.0,100,100,100,18.2,11,2,100,100,12,3564,87.7
4237,Best Cat Brushes UK (2026) – Guide by Coat Type,Cat Supplies,100.0,100,100,100,10.0,10,1,100,100,13,3685,86.5
4230,Best Cat Grooming Supplies UK (2026) – Complete Guide,Cat Supplies,100.0,100,100,100,15.4,13,2,100,100,17,3885,87.3
4223,Best Cat Window Perches UK (2026) – Sunning & Bird Watching,Cat Supplies,100.0,100,100,100,16.7,12,2,100,100,14,3382,87.5
4216,Best Cat Radiator Beds UK (2026) – Hook-On Warmth Guide,Cat Supplies,100.0,100,100,100,25.0,12,3,100,100,14,3512,88.8
4209,Best Heated Cat Beds UK (2026) – Winter Warmth Guide,Cat Supplies,100.0,100,100,100,27.3,11,3,100,100,14,3615,89.1
4202,Best Cat Beds UK (2026) – Complete Guide,Cat Supplies,100.0,100,100,100,16.7,12,2,100,100,14,3968,87.5
4195,Best Cat Toys for Indoor Cats UK (2026) – Enrichment Guide,Cat Supplies,100.0,100,100,100,16.7,12,2,100,100,10,3858,87.5
4188,Best Catnip Toys UK (2026) – What Works and Why,Cat Supplies,100.0,100,100,100,20.0,10,2,100,100,20,4003,88.0
4181,Best Interactive Cat Toys UK (2026) – Wand & Puzzle Guide,Cat Supplies,100.0,100,100,100,18.2,11,2,100,100,20,4346,87.7
4174,Best Cat Toys UK (2026) – Complete Guide,Cat Supplies,100.0,100,100,100,16.7,12,2,100,100,20,4855,87.5
4167,Best Dog Water Bottles UK (2026) – Travel Hydration Guide,Dog Supplies,100.0,100,100,100,21.4,14,3,100,100,20,4383,88.2
4160,Best Elevated Dog Bowls UK (2026) – Raised Feeder Guide,Dog Supplies,100.0,100,100,100,35.7,14,5,100,100,18,4144,90.4
4153,Best Slow Feeder Dog Bowls UK (2026) – Prevent Speed Eating,Dog Supplies,100.0,100,100,100,23.1,13,3,0,100,12,4088,83.5
4146,Best Dog Bowls and Feeding UK (2026) – Complete Guide,Dog Supplies,100.0,100,100,100,21.4,14,3,100,100,13,3947,88.2
4139,Best Dog Training Leads UK (2026) – Long Lines & Harnesses,Dog Supplies,100.0,100,100,100,23.1,13,3,100,100,12,4469,88.5
4132,Best Puppy Training Guide UK (2026) – First Year Essentials,Dog Supplies,100.0,100,100,100,7.7,13,1,100,100,15,4452,86.2
4125,Best Dog Training Treats UK (2026) – Reward Guide,Dog Supplies,100.0,100,100,100,15.4,13,2,100,100,12,4072,87.3
4118,Best Dog Training and Behaviour UK (2026) – Complete Guide,Dog Supplies,100.0,100,100,100,13.3,15,2,100,100,12,4429,87.0
4110,Best Dog Joint Supplements UK (2026) – Mobility Support Guide,Dog Health,100.0,100,100,100,21.4,14,3,100,100,14,4465,88.2
4103,Best Dog Flea Treatment UK (2026) – Prevention Guide,Dog Health,100.0,100,100,100,15.4,13,2,100,100,14,4608,87.3
4096,Best Dog Dental Care UK (2026) – Teeth Cleaning Guide,Dog Health,100.0,100,100,100,15.4,13,2,100,100,10,4292,87.3
4089,Best Dog Health and Care UK (2026) – Complete Guide,Dog Health,100.0,100,100,100,14.3,14,2,100,100,14,4564,87.1
4078,Best Dog Nail Clippers UK (2026) – Trimming & Grinding Guide,Dog Care,100.0,100,100,100,15.4,13,2,100,100,11,4198,87.3
4071,Best Dog Shampoo UK (2026) – Ingredients & Safety Guide,Dog Care,100.0,100,100,100,14.3,14,2,100,100,13,3902,87.1
4064,Best Dog Brushes UK (2026) – Guide by Coat Type,Dog Care,100.0,100,100,100,8.3,12,1,100,100,12,4021,86.2
4057,Best Dog Grooming Supplies UK (2026) – Complete Guide,Dog Care,100.0,100,100,100,14.3,14,2,100,100,12,4959,87.1
4049,Best Puppy Collars UK (2026) – First Collar & Harness Guide,Dog Supplies,100.0,100,100,100,20.0,10,2,100,100,12,4080,88.0
4042,Best Dog Leads UK (2026) – Walking & Training Lead Guide,Dog Supplies,100.0,100,100,100,16.7,12,2,100,100,14,4084,87.5
4034,Best No-Pull Dog Harnesses UK (2026) – Training & Comfort Guide,Dog Harnesses,100.0,100,100,50,0.0,11,0,100,100,14,3704,77.5
4027,Best Dog Collars and Harnesses UK (2026) – Complete Guide,Dog Harnesses,100.0,100,100,50,0.0,13,0,100,100,14,4025,77.5
4018,Best Puppy Beds UK (2026) – First Bed & Crate Training Guide,Dog Beds,100.0,100,100,100,16.7,12,2,100,100,13,4133,87.5
4011,Best Cooling Dog Beds UK (2026) – Temperature Regulation Guide,Dog Beds,100.0,100,100,100,14.3,14,2,100,100,7,4185,84.1
4004,Best Orthopaedic Dog Beds UK (2026) – Joint Support Guide,Dog Beds,100.0,100,100,100,28.6,14,4,100,100,7,4475,86.3
3996,Best Dog Beds UK (2026) – Complete Guide & Honest Reviews,Dog Beds,100.0,100,100,100,6.7,15,1,100,100,16,4887,86.0
3960,Best Puppy Toys UK (2026) – Teething & First Toys Guide,Dog Supplies,100.0,100,100,100,31.2,16,5,100,100,20,5735,89.7
3959,Best Interactive Dog Toys UK (2026) – Puzzle & Enrichment Guide,Dog Supplies,100.0,100,100,100,14.3,14,2,100,100,8,4476,85.1
3957,Best Indestructible Dog Toys UK (2026) – Tough Toys for Heavy Chewers,Dog Supplies,100.0,100,100,100,31.2,16,5,100,100,9,4708,88.7
3956,Best Dog Toys UK (2026) – Complete Guide & Honest Reviews,Dog Supplies,100.0,100,100,100,13.3,15,2,100,100,15,4850,87.0
3839,Best Puppy Food UK (2026) - Growth-Stage Nutrition Guide,Dog Food,100.0,100,100,50,8.3,12,1,0,100,17,5687,73.8
3838,Dry vs Wet Dog Food UK - An Honest Comparison Guide,Dog Food,100.0,100,100,50,18.2,11,2,0,100,17,5304,75.2
3837,Best Dry Dog Food UK (2026) - Evidence-Based Guide,Dog Food,100.0,100,100,50,6.7,15,1,0,100,17,6223,73.5
3836,Best Dog Food UK (2026) - Complete Buying Guide,Dog Food,100.0,100,100,50,0.0,16,0,0,100,14,7587,72.5
696,Essential Cat Supplies for Cat Owners - Number 1 Must-Haves,Cat Supplies,100.0,100,100,100,0.0,3,0,100,100,10,3460,85.0
3,Dog Toys UK (2026) – Essential Guide for Pet Owners,Dog Supplies,100.0,100,100,100,6.7,15,1,0,100,20,5663,81.0
