post_id,title,cluster,word_count,has_comparison,has_faq,uk_signals,status
12813,Cat Puzzle Feeders UK: Best Options for Mental Stimulation (2026),Cat Toys,1044,Yes,Yes,28,draft
12816,Catios UK: Outdoor Cat Enclosures Guide and Comparison (2026),Indoor Cats,1169,Yes,Yes,47,draft
12817,Dog Travel Accessories UK: Car Safety and Comfort Essentials (2026),Dog Supplies,1083,Yes,Yes,27,draft
12820,Dog Coats UK: Weather Protection Guide by Breed Size (2026),Dog Supplies,1239,Yes,Yes,31,draft
12823,Interactive Cat Toys UK: Best Types for Solo and Multi-Cat Play (2026),Cat Toys,1202,Yes,Yes,31,draft
