id,title,cluster,content_len,word_count,has_faq,has_sources,has_quick_answer,has_comparison_table,has_glossary,has_trust_links,internal_links,external_links,headings
6052,Low-Mobility Enrichment: Mental Stimulation for Dogs with Limited Movement,Dog Toys,11126,1059,True,False,True,True,False,False,10,3,14
6050,Toy Overstimulation Recovery: Calming Down an Overexcited Dog,Dog Toys,10984,1037,True,False,True,True,False,False,9,3,14
6049,Sensory Enrichment for Dogs: Engaging All Five Senses Through Play,Dog Toys,12011,1112,True,False,True,True,False,False,10,3,15
6048,Confidence-Building Play: Helping Shy and Fearful Dogs Through Toys,Uncategorized,10638,1020,True,False,True,True,False,False,9,3,14
6047,Play Recovery After Surgery: Gentle Enrichment for Healing Dogs,Dog Toys,12176,1169,True,False,True,True,False,False,12,3,15
6046,Dog Toy Hygiene Schedules: A Practical Cleaning Timetable,Dog Toys,11321,1079,True,False,True,True,False,False,9,3,15
6045,Safe Multi-Dog Toy Management: Preventing Resource Guarding,Dog Toys,11225,1040,True,False,True,True,False,False,10,3,15
6044,Rotating Puzzle Complexity: Progressive Challenge for Smart Dogs,Uncategorized,11286,1089,True,False,True,True,False,False,9,3,16
6042,Enrichment by Breed Group: Tailoring Play to Your Dog's Instincts,Dog Toys,6454,563,False,False,True,True,False,False,5,3,7
6039,Dog Toy Anxiety Reduction: Using Toys to Calm Nervous Dogs,Dog Toys,11824,1110,True,False,True,True,False,False,11,3,15
5950,Dog Toy Durability Guide: What Lasts and What Does Not,Dog Toys,13137,1287,True,False,True,False,False,False,13,3,20
5946,"Dog Toy Materials Compared: Rubber, Rope, Plush, and Nylon",Dog Toys,13398,1302,True,False,True,False,False,False,12,3,24
5942,Cognitive Enrichment for Senior Dogs: Gentle Play for Ageing Minds,Dog Toys,11653,1144,True,False,True,False,False,False,9,3,17
5938,Enrichment Schedules for Dogs: Structuring Daily Play and Mental Work,Dog Toys,11669,1081,True,False,True,False,False,False,13,3,19
5935,Dog Toy Storage and Organisation: Keeping Toys Clean and Accessible,Dog Toys,11653,1135,True,False,True,False,False,False,11,3,19
5934,Crate and Play Enrichment: Keeping Dogs Happy in Confined Spaces,Dog Toys,10326,931,True,False,False,False,False,False,5,3,18
5933,"Safe Tug Play with Dogs: Rules, Benefits, and Common Mistakes",Dog Toys,9956,870,True,False,False,False,False,False,5,3,16
5932,Scent-Game Enrichment for Dogs: Using Smell to Engage Your Dog,Dog Toys,9654,891,True,False,False,False,False,False,4,3,18
5931,Signs of Toy Overstimulation in Dogs: When Play Becomes Too Much,Dog Toys,10606,940,True,False,False,False,False,False,5,3,16
5930,Dog Toy Safety by Breed Size: Choosing the Right Size Toy,Dog Toys,9838,903,True,False,False,False,False,False,4,3,18
5523,"Dog Training Equipment Explained: Tools, Uses, and What to Avoid",Dog Training,25196,2689,True,False,True,True,True,False,7,3,39
5522,"Orthopaedic Care for Dogs: Joint Health, Mobility, and Support",Dog Beds,34154,3619,True,False,True,False,False,False,7,1,28
5521,Pet Health Terminology: A Guide to Common Veterinary Terms,Educational,28870,2833,True,False,True,False,True,False,9,3,43
5520,"Dog Health Basics: Common Conditions, Prevention, and When to See a Vet",Dog Health,23385,2878,True,False,True,False,False,True,8,2,41
5519,Indoor Cat Care: A Complete Guide to Keeping House Cats Happy and Healthy,Indoor Cats,27657,2990,True,False,True,False,False,False,9,2,37
5512,Dog Behaviour Explained: Understanding Your Dog's Body Language and Actions,Dog Training,25908,2512,True,False,True,False,True,False,7,3,39
5511,"Pet Enrichment Explained: Types, Benefits, and Practical Ideas",Dog Toys,28158,3047,True,False,True,False,True,False,9,2,42
5510,Dog Bed Sizing Guide: How to Measure Your Dog and Choose the Right Fit,Dog Beds,28480,3458,True,False,True,True,False,False,7,2,35
5509,"Pet Toy Safety: Understanding Materials, Hazards, and Standards",Dog Toys,28167,3064,True,False,True,True,False,False,7,2,34
5508,Puppy Development Stages: A Complete Guide from Birth to Maturity,Puppy Care,29395,2958,True,False,True,False,False,False,7,3,38
5483,Dog Toy Lifespan: When to Replace Toys and How to Extend Their Life,Dog Toys,25356,2790,True,False,True,False,False,False,9,3,35
5476,"Mental Stimulation Toys for Dogs: Puzzles, Games, and Brain Work",Dog Toys,25026,2626,True,False,True,True,False,False,11,3,29
5473,Senior Dog Toys: Gentle Play Options for Older Dogs,Dog Toys,24358,2579,True,False,True,False,False,False,7,3,23
5471,"Dog Boredom Prevention: Signs, Solutions, and Enrichment Ideas",Dog Toys,25467,2561,True,False,True,False,False,False,7,3,29
5469,Dog Toy Rotation: How to Keep Your Dog Interested and Engaged,Dog Toys,24082,2465,True,False,True,True,False,False,8,3,30
5467,"Pet Feeding Guide: Understanding Portions, Schedules, and Methods",Dog Food,24675,2855,True,False,True,True,False,False,6,2,31
5464,Pet Grooming Glossary: Understanding Grooming Terms and Techniques,Dog Grooming,23756,2787,True,False,True,False,True,False,5,3,35
5462,Dog Training Terminology Explained: Key Concepts for New Owners,Educational,22124,2442,True,False,True,False,True,False,7,3,35
5460,Pet Nutrition Terminology: A Guide to Common Terms on Pet Food Labels,Dog Food,20420,2276,True,False,True,False,True,False,7,2,28
5458,Cat Scratching Behaviour Explained: Why Cats Scratch and How to Help,Dog Training,23052,2454,True,False,True,True,True,False,8,2,33
5425,Dog Toys FAQ: Common Questions Answered,Dog Toys,16269,1889,True,True,True,False,False,False,13,3,21
5424,Aggressive Chewer Guide: Safe Toys for Power Chewers,Educational,15213,1794,True,True,True,False,False,False,11,3,24
5423,Dog Toy Enrichment: Beyond Basic Fetch,Dog Toys,15900,1877,True,True,True,False,False,False,15,3,24
5422,Indoor vs Outdoor Dog Toys: Choosing the Right Type,Dog Toys,13476,1552,True,True,True,True,False,False,10,3,26
5421,Puppy-Safe Dog Toys: What to Look For and What to Avoid,Dog Toys,13568,1597,True,True,True,False,False,False,12,3,27
5420,Dog Toy Cleaning Guide: How to Keep Toys Hygienic,Dog Toys,15547,1853,True,True,True,True,False,False,11,3,26
5419,Cat Care Basics: A Glossary for New Cat Owners,Educational,17603,2033,True,True,True,False,True,False,6,3,22
5418,Dog Harness Types Explained: Finding the Right Fit,Dog Harnesses,16999,1978,True,True,True,True,True,False,4,3,22
5417,Puppy Care Essentials: Key Terms Every New Owner Should Know,Puppy Care,16319,1862,True,True,True,False,False,False,8,3,21
5416,Dog Bed Types Explained: A Complete Glossary,Educational,16042,1849,True,True,True,True,True,False,4,3,22
5415,Dog Play Styles Explained: Understanding How Your Dog Plays,Educational,10317,1095,True,True,True,False,True,False,13,3,17
5414,Cat Toy Types Explained: A Complete Glossary,Educational,11829,1039,True,True,True,False,True,False,11,3,28
5296,Best Indoor Cat Toys UK (2026): Complete Guide for House Cats,Indoor Cats,13128,1326,True,True,True,False,False,False,8,3,19
5033,How to Choose the Right Cat Toy for Your Cat's Personality,Cat Toys,9607,878,True,True,True,False,False,False,11,3,12
5036,Understanding Cat Play Behaviour: What Different Play Styles Mean,Dog Training,10130,885,True,True,True,True,False,False,11,3,13
5032,Cat Toys FAQ: Common Questions Answered,Cat Toys,11582,1185,True,True,True,False,False,False,11,3,14
5035,Cat Enrichment Beyond Toys: Creating a Stimulating Home,Dog Toys,16848,1703,True,True,True,True,False,False,11,3,17
5034,Cat Toy Rotation: How to Keep Toys Fresh and Engaging,Dog Toys,13807,1440,True,True,True,False,False,False,11,3,15
4792,Puppy Socialisation: A Complete Timeline Guide,Dog Training,13087,1154,True,False,True,False,False,False,12,2,17
4791,How to Choose the Right Dog Training Treats,Dog Training,10714,925,True,True,True,False,False,False,7,3,16
4790,DIY Dog Toys: Safe Homemade Options,Dog Toys,10196,1077,True,True,True,False,False,False,10,3,18
4789,Best Types of Dog Toys for Different Play Styles,Dog Toys,11104,1158,True,True,True,False,False,False,11,3,18
4788,Mental Stimulation for Dogs: Beyond Physical Exercise,Dog Toys,11338,986,True,True,True,False,False,False,7,3,16
4787,Dog Toy Safety: What Every Owner Needs to Know,Dog Toys,10299,1061,True,True,True,False,False,False,10,3,18
4786,Where to Place Your Dog's Bed: Location and Comfort Tips,Uncategorized,10978,1032,True,True,True,False,False,False,7,2,16
4785,How to Wash and Maintain Your Dog's Bed,Uncategorized,10972,998,True,True,True,False,False,False,7,3,16
4784,"Dog Bed Materials Explained: Foam, Memory Foam, and More",Dog Beds,12744,1064,True,True,True,True,True,False,8,3,18
4783,How to Choose the Right Dog Bed Size,Dog Beds,11127,979,True,True,True,False,False,False,8,3,17
4573,Seasonal Pet Safety: Protecting Pets Through the Year,Uncategorized,10644,957,True,True,True,False,False,False,9,3,13
4570,First-Time Dog Owner Essentials: What You Need to Know,Uncategorized,13497,1168,True,True,True,True,False,False,10,3,15
4576,Multi-Pet Household Tips: Living with Dogs and Cats Together,Uncategorized,10401,962,True,True,True,False,False,False,5,3,13
4574,Pet Hydration Guide: How Much Water Does Your Pet Need?,Educational,10502,957,True,True,True,False,False,False,6,3,13
4571,Pet First Aid Basics: What Every Owner Should Know,Uncategorized,10752,981,True,True,True,False,False,False,10,3,13
4568,Dog Dental Health: A Practical Care Guide,Dog Health,9831,1075,True,False,True,False,False,True,12,2,14
4566,Seasonal Dog Care: Keeping Your Dog Safe Year-Round,Dog Care,12248,1164,True,True,True,True,False,False,6,3,13
4563,Dog Grooming Basics: A Complete Guide for Owners,Dog Grooming,10053,1075,True,True,True,False,False,True,12,3,15
4415,Cat Toy Safety Guide: What Every Owner Should Know,Dog Toys,11406,1126,True,True,True,True,False,True,17,3,18
4406,Best Interactive Cat Toys for Indoor Cats: Engagement Guide,Cat Toys,11743,1035,True,True,True,False,False,False,16,3,16
4414,Harness vs Collar: Which Is Better for Your Dog?,Dog Harnesses,10265,1008,True,True,True,True,False,True,15,3,14
4413,How to Measure Your Dog for a Harness: Step-by-Step Guide,Dog Harnesses,9627,982,True,True,True,False,False,True,15,3,16
4412,No-Pull Dog Harness Guide: How They Work and When to Use One,Dog Harnesses,8984,942,True,True,True,False,False,True,12,3,14
4411,"Dog Harnesses: The Complete Guide to Types, Fitting, and Safety",Dog Harnesses,11899,1246,True,True,True,True,False,True,15,3,20
4410,Cat Enrichment Activities Beyond Toys: Complete Guide,Dog Toys,11837,1145,True,True,True,True,False,True,16,3,20
4409,Kitten vs Adult Cat Toys: Age-Appropriate Play Guide,Cat Toys,11276,1098,True,True,True,True,False,True,15,3,18
4408,How Often Should You Replace Cat Toys? A Practical Guide,Cat Toys,9070,930,True,True,True,False,False,True,14,3,17
4407,DIY Cat Toys: Safe Homemade Options Your Cat Will Love,Cat Toys,11988,1102,True,True,True,True,False,False,10,3,17
4335,Best Cat Litter Disposal UK (2026) – Waste Management Guide,Cat Supplies,14443,1073,True,True,True,False,False,True,10,3,19
4328,Best Self-Cleaning Litter Trays UK (2026) – Automatic Options,Uncategorized,14020,1016,True,True,True,False,False,True,11,3,19
4321,Best Cat Litter UK (2026) – Types &#038; Comparison Guide,Cat Supplies,14213,1011,True,True,True,False,False,True,11,3,19
4314,Best Cat Litter Trays UK (2026) – Complete Guide,Cat Supplies,15525,1237,True,True,True,False,False,True,10,3,21
4307,Best Wall-Mounted Cat Scratchers UK (2026) – Space Saving,Cat Toys,13622,991,True,True,True,False,False,True,10,3,19
4300,Best Cardboard Cat Scratchers UK (2026) – Budget Friendly,Cat Toys,13573,974,True,True,True,False,False,True,10,3,19
4293,Best Cat Trees UK (2026) – Climbing & Scratching Towers,Uncategorized,13768,1025,True,True,True,False,False,True,10,3,19
4286,Best Cat Scratching Posts UK (2026) – Complete Guide,Cat Toys,15677,1200,True,True,True,False,False,True,11,3,20
4279,Best Cat Harnesses UK (2026) – Safe Walking Guide,Dog Harnesses,13535,1026,True,True,True,False,False,True,10,3,18
4272,Best Cat ID Tags UK (2026) – Identification Guide,Educational,13377,1145,True,True,True,False,False,True,16,3,19
4265,Best Cat GPS Trackers UK (2026) – Location Tracking Guide,Educational,13721,1011,True,True,True,False,False,True,10,3,18
4258,Best Cat Collars UK (2026) – Complete Safety Guide,Dog Harnesses,13155,1155,True,True,True,False,False,True,10,3,20
4251,Best Cat Shampoo UK (2026) – When & How to Bathe,Dog Grooming,14536,1069,True,True,True,False,False,True,13,3,19
4244,Best Cat Nail Clippers UK (2026) – Safe Trimming Guide,Dog Grooming,13801,1035,True,True,True,False,False,True,12,3,18
4237,Best Cat Brushes UK (2026) – Guide by Coat Type,Dog Grooming,14080,1019,True,True,True,False,False,True,13,3,18
4230,Best Cat Grooming Supplies UK (2026) – Complete Guide,Dog Grooming,13300,1198,True,True,True,False,False,True,17,3,20
4223,Best Cat Window Perches UK (2026) – Sunning & Bird Watching,Uncategorized,13286,995,True,True,True,False,False,True,7,3,17
4216,Best Cat Radiator Beds UK (2026) – Hook-On Warmth Guide,Educational,12929,962,True,True,True,False,False,True,8,3,17
4209,Best Heated Cat Beds UK (2026) – Winter Warmth Guide,Cat Supplies,13199,977,True,True,True,False,False,True,7,3,17
4202,Best Cat Beds UK (2026) – Complete Guide,Cat Supplies,14543,1134,True,True,True,False,False,True,9,3,19
4195,Best Cat Toys for Indoor Cats UK (2026) – Enrichment Guide,Dog Toys,17644,1277,True,True,True,False,False,True,26,3,18
4188,Best Catnip Toys UK (2026) – What Works and Why,Cat Toys,17285,1274,True,True,True,False,False,True,29,3,17
4181,Best Interactive Cat Toys UK (2026) – Wand & Puzzle Guide,Cat Toys,15939,1184,True,True,True,False,False,True,21,3,17
4174,Best Cat Toys UK (2026) – Complete Guide,Cat Toys,19002,1447,True,True,True,False,False,True,29,3,19
4167,Best Dog Water Bottles UK (2026) – Travel Hydration Guide,Educational,13658,1198,True,True,True,False,False,True,23,3,21
4160,Best Elevated Dog Bowls UK (2026) – Raised Feeder Guide,Educational,13028,1176,True,True,True,False,False,True,18,3,21
4153,Best Slow Feeder Dog Bowls UK (2026) – Prevent Speed Eating,Uncategorized,14153,1045,True,True,True,False,False,True,11,3,20
4146,Best Dog Bowls and Feeding UK (2026) – Complete Guide,Educational,16333,1238,True,True,True,False,False,True,12,3,22
4139,Best Dog Training Leads UK (2026) – Long Lines & Harnesses,Dog Harnesses,13899,1052,True,True,True,False,False,True,7,3,19
4132,Best Puppy Training Guide UK (2026) – First Year Essentials,Dog Training,14525,1042,True,True,True,False,False,True,8,3,20
4125,Best Dog Training Treats UK (2026) – Reward Guide,Dog Training,13952,1029,True,True,True,False,False,True,8,3,19
4118,Best Dog Training and Behaviour UK (2026) – Complete Guide,Dog Training,15389,1125,True,True,True,False,False,True,7,3,21
4110,Best Dog Joint Supplements UK (2026) – Mobility Support Guide,Dog Health,14727,1080,True,True,True,False,False,True,7,3,21
4103,Best Dog Flea Treatment UK (2026) – Prevention Guide,Dog Health,12978,1117,True,True,True,False,False,True,7,3,20
4096,Best Dog Dental Care UK (2026) – Teeth Cleaning Guide,Dog Health,13848,1041,True,True,True,False,False,True,7,3,19
4089,Best Dog Health and Care UK (2026) – Complete Guide,Dog Health,15075,1136,True,True,True,False,False,True,7,3,20
4078,Best Dog Nail Clippers UK (2026) – Trimming & Grinding Guide,Dog Grooming,13567,993,True,True,True,False,False,True,11,3,18
4071,Best Dog Shampoo UK (2026) – Ingredients & Safety Guide,Dog Grooming,14482,1000,True,True,True,False,False,True,13,3,21
4064,Best Dog Brushes UK (2026) – Guide by Coat Type,Dog Grooming,14720,1041,True,True,True,False,False,True,12,3,19
4057,Best Dog Grooming Supplies UK (2026) – Complete Guide,Dog Grooming,16598,1274,True,True,True,False,False,True,12,3,21
4049,Best Puppy Collars UK (2026) – First Collar & Harness Guide,Dog Harnesses,14430,1066,True,True,True,False,False,True,12,3,18
4042,Best Dog Leads UK (2026) – Walking & Training Lead Guide,Dog Harnesses,15625,1181,True,True,True,False,False,True,10,3,20
4034,Best No-Pull Dog Harnesses UK (2026) – Training & Comfort Guide,Dog Harnesses,15638,1198,True,True,True,False,False,True,11,3,19
4027,Best Dog Collars and Harnesses UK (2026) – Complete Guide,Dog Harnesses,16345,1491,True,True,True,False,False,True,9,4,27
4018,Best Puppy Beds UK (2026) – First Bed & Crate Training Guide,Dog Beds,16679,1284,True,True,True,False,False,True,13,3,22
4011,Best Cooling Dog Beds UK (2026) – Temperature Regulation Guide,Dog Beds,15529,1152,True,True,True,False,False,True,8,3,21
4004,Best Orthopaedic Dog Beds UK (2026) – Joint Support Guide,Dog Beds,16545,1218,True,True,True,False,False,True,9,3,23
3996,Best Dog Beds UK (2026) – Complete Guide & Honest Reviews,Dog Beds,19736,1576,True,False,True,False,False,True,16,1,27
3960,Best Puppy Toys UK (2026) – Teething & First Toys Guide,Puppy Care,20711,1697,True,True,True,False,False,True,8,3,33
3959,Best Interactive Dog Toys UK (2026) – Puzzle & Enrichment Guide,Dog Toys,20155,1616,True,False,True,False,False,True,9,1,31
3957,Best Indestructible Dog Toys UK (2026) – Tough Toys for Heavy Chewers,Dog Toys,19496,1547,True,True,True,False,False,True,8,3,29
3956,Best Dog Toys UK (2026) – Complete Guide & Honest Reviews,Dog Toys,18671,1789,True,False,True,False,False,True,14,2,29
3839,Best Puppy Food UK (2026) - Growth-Stage Nutrition Guide,Dog Food,31420,2171,True,True,True,True,False,False,8,3,33
3838,Dry vs Wet Dog Food UK - An Honest Comparison Guide,Dog Food,27396,1863,True,True,True,True,False,False,8,3,29
3837,Best Dry Dog Food UK (2026) - Evidence-Based Guide,Dog Food,36056,2987,True,True,True,True,False,False,9,3,34
3836,Best Dog Food UK (2026) - Complete Buying Guide,Dog Food,49814,4327,True,True,True,True,False,False,7,3,42
696,Essential Cat Supplies for Cat Owners - Number 1 Must-Haves,Cat Supplies,13751,840,True,True,True,False,False,True,13,4,17
3,Dog Toys UK (2026) – Essential Guide for Pet Owners,Dog Toys,8628,587,True,True,True,False,False,False,10,3,10
