post_id,title,has_affiliate_link,has_editorial_link,has_research_link,has_corrections_link
4251,Best Cat Shampoo UK (2026) – When & How to Bathe,yes,no,no,no
5933,"Safe Tug Play with Dogs: Rules, Benefits, and Common Mistakes",no,no,no,no
6048,Confidence-Building Play: Helping Shy and Fearful Dogs Through Toys,no,no,no,no
4160,Best Elevated Dog Bowls UK (2026) – Raised Feeder Guide,yes,yes,no,yes
5296,Best Indoor Cat Toys UK (2026): Complete Guide for House Cats,no,no,no,no
5417,Puppy Care Essentials: Key Terms Every New Owner Should Know,no,no,no,no
5420,Dog Toy Cleaning Guide: How to Keep Toys Hygienic,no,no,no,no
5521,Pet Health Terminology: A Guide to Common Veterinary Terms,no,no,no,no
3837,Best Dry Dog Food UK (2026) - Evidence-Based Guide,no,no,no,no
5934,Crate and Play Enrichment: Keeping Dogs Happy in Confined Spaces,no,no,no,no
4216,Best Cat Radiator Beds UK (2026) – Hook-On Warmth Guide,yes,no,no,no
4004,Best Orthopaedic Dog Beds UK (2026) – Joint Support Guide,yes,no,no,no
4335,Best Cat Litter Disposal UK (2026) – Waste Management Guide,yes,no,no,no
5938,Enrichment Schedules for Dogs: Structuring Daily Play and Mental Work,no,no,no,no
4293,Best Cat Trees UK (2026) – Climbing & Scratching Towers,yes,no,no,no
4574,Pet Hydration Guide: How Much Water Does Your Pet Need?,no,no,no,no
6047,Play Recovery After Surgery: Gentle Enrichment for Healing Dogs,no,no,no,no
3836,Best Dog Food UK (2026) - Complete Buying Guide,no,no,no,no
4042,Best Dog Leads UK (2026) – Walking & Training Lead Guide,yes,no,no,no
5421,Puppy-Safe Dog Toys: What to Look For and What to Avoid,no,no,no,no
5419,Cat Care Basics: A Glossary for New Cat Owners,no,no,no,no
4411,"Dog Harnesses: The Complete Guide to Types, Fitting, and Safety",yes,yes,no,yes
4279,Best Cat Harnesses UK (2026) – Safe Walking Guide,yes,no,no,no
4071,Best Dog Shampoo UK (2026) – Ingredients & Safety Guide,yes,no,no,no
4321,Best Cat Litter UK (2026) – Types &#038; Comparison Guide,yes,no,no,no
5423,Dog Toy Enrichment: Beyond Basic Fetch,no,no,no,no
4181,Best Interactive Cat Toys UK (2026) – Wand & Puzzle Guide,yes,no,no,no
4237,Best Cat Brushes UK (2026) – Guide by Coat Type,yes,no,no,no
4195,Best Cat Toys for Indoor Cats UK (2026) – Enrichment Guide,yes,no,no,no
4034,Best No-Pull Dog Harnesses UK (2026) – Training & Comfort Guide,yes,no,no,no
