id,title,cluster,slug,incoming_links
5950,Dog Toy Durability Guide: What Lasts and What Does Not,Dog Toys,dog-toy-durability-guide,1
5935,Dog Toy Storage and Organisation: Keeping Toys Clean and Accessible,Dog Toys,dog-toy-storage-organisation,1
5933,"Safe Tug Play with Dogs: Rules, Benefits, and Common Mistakes",Dog Toys,safe-tug-play-dogs,1
5930,Dog Toy Safety by Breed Size: Choosing the Right Size Toy,Dog Toys,dog-toy-safety-breed-size,1
5520,"Dog Health Basics: Common Conditions, Prevention, and When to See a Vet",Dog Health,dog-health-basics-guide,1
5511,"Pet Enrichment Explained: Types, Benefits, and Practical Ideas",Dog Toys,pet-enrichment-guide,1
5510,Dog Bed Sizing Guide: How to Measure Your Dog and Choose the Right Fit,Dog Beds,dog-bed-sizing-guide,1
5508,Puppy Development Stages: A Complete Guide from Birth to Maturity,Puppy Care,puppy-development-stages-guide,1
5467,"Pet Feeding Guide: Understanding Portions, Schedules, and Methods",Dog Food,pet-feeding-guide,1
5460,Pet Nutrition Terminology: A Guide to Common Terms on Pet Food Labels,Dog Food,pet-nutrition-terminology-guide,1
5458,Cat Scratching Behaviour Explained: Why Cats Scratch and How to Help,Dog Training,cat-scratching-behaviour-explained,1
5421,Puppy-Safe Dog Toys: What to Look For and What to Avoid,Dog Toys,puppy-safe-dog-toys,1
5419,Cat Care Basics: A Glossary for New Cat Owners,Educational,cat-care-basics-glossary,1
5418,Dog Harness Types Explained: Finding the Right Fit,Dog Harnesses,dog-harness-types-glossary,1
5415,Dog Play Styles Explained: Understanding How Your Dog Plays,Educational,dog-play-styles-explained,1
5414,Cat Toy Types Explained: A Complete Glossary,Educational,cat-toy-types-glossary,1
5296,Best Indoor Cat Toys UK (2026): Complete Guide for House Cats,Indoor Cats,best-indoor-cat-toys,1
4064,Best Dog Brushes UK (2026) – Guide by Coat Type,Dog Grooming,best-dog-brushes-uk,1
4011,Best Cooling Dog Beds UK (2026) – Temperature Regulation Guide,Dog Beds,best-cooling-dog-beds-uk,1
4004,Best Orthopaedic Dog Beds UK (2026) – Joint Support Guide,Dog Beds,best-orthopaedic-dog-beds-uk,1
3960,Best Puppy Toys UK (2026) – Teething & First Toys Guide,Puppy Care,best-puppy-toys-uk,1
3959,Best Interactive Dog Toys UK (2026) – Puzzle & Enrichment Guide,Dog Toys,best-interactive-dog-toys-uk,1
