post_id,title,cluster,word_count,has_faq,faq_count,has_glossary,glossary_terms,has_trust,has_comparison,has_practical,has_related,has_external_ref,internal_links
5950,Dog Toy Durability Guide: What Lasts and What Does Not,Dog Toys,1635,True,9,True,6,True,False,False,True,False,13
5946,"Dog Toy Materials Compared: Rubber, Rope, Plush, and Nylon",Dog Toys,1641,True,14,True,6,True,False,False,True,False,11
5942,Cognitive Enrichment for Senior Dogs: Gentle Play for Ageing Minds,Dog Toys,1444,True,6,True,6,True,False,False,True,False,9
5938,Enrichment Schedules for Dogs: Structuring Daily Play and Mental Work,Dog Toys,1379,True,10,True,6,True,False,False,True,False,12
5935,Dog Toy Storage and Organisation: Keeping Toys Clean and Accessible,Dog Toys,1456,True,9,True,6,True,False,False,True,False,11
5934,Crate and Play Enrichment: Keeping Dogs Happy in Confined Spaces,Dog Toys,1115,True,11,True,6,True,False,False,True,False,4
5933,"Safe Tug Play with Dogs: Rules, Benefits, and Common Mistakes",Dog Toys,1066,True,8,True,11,True,False,False,True,False,4
5932,Scent-Game Enrichment for Dogs: Using Smell to Engage Your Dog,Dog Toys,1062,True,12,True,6,True,False,False,True,False,4
5931,Signs of Toy Overstimulation in Dogs: When Play Becomes Too Much,Dog Toys,1124,True,8,True,14,True,False,False,True,False,4
5930,Dog Toy Safety by Breed Size: Choosing the Right Size Toy,Dog Toys,1108,True,12,True,6,True,False,False,True,False,4
5523,"Dog Training Equipment Explained: Tools, Uses, and What to Avoid",Dog Supplies,3281,True,29,True,0,True,True,False,True,False,7
5522,"Orthopaedic Care for Dogs: Joint Health, Mobility, and Support",Dog Beds,4339,True,16,True,0,True,False,False,True,False,7
5521,Pet Health Terminology: A Guide to Common Veterinary Terms,Dog Food,3553,True,34,True,19,True,False,False,True,False,8
5520,"Dog Health Basics: Common Conditions, Prevention, and When to See a Vet",Dog Care,2889,True,0,True,6,True,False,False,True,False,8
5519,Indoor Cat Care: A Complete Guide to Keeping House Cats Happy and Healthy,Cat Toys,3610,True,25,True,0,True,False,False,True,False,9
5512,Dog Behaviour Explained: Understanding Your Dog's Body Language and Actions,Uncategorized,3224,True,29,True,0,True,False,True,True,False,7
5511,"Pet Enrichment Explained: Types, Benefits, and Practical Ideas",Dog Toys,3550,True,32,True,0,True,False,False,True,False,7
5510,Dog Bed Sizing Guide: How to Measure Your Dog and Choose the Right Fit,Dog Beds,4082,True,24,True,0,True,True,False,True,False,7
5509,"Pet Toy Safety: Understanding Materials, Hazards, and Standards",Dog Toys,3695,True,23,True,8,True,True,False,True,False,7
5508,Puppy Development Stages: A Complete Guide from Birth to Maturity,Puppy Care,3711,True,29,True,18,True,False,False,True,False,7
5483,Dog Toy Lifespan: When to Replace Toys and How to Extend Their Life,Dog Toys,3426,True,25,True,19,True,False,True,True,False,9
5476,"Mental Stimulation Toys for Dogs: Puzzles, Games, and Brain Work",Dog Toys,3175,True,18,True,17,True,True,False,True,False,9
5473,Senior Dog Toys: Gentle Play Options for Older Dogs,Dog Toys,3141,True,11,True,22,True,False,True,True,False,6
5471,"Dog Boredom Prevention: Signs, Solutions, and Enrichment Ideas",Dog Toys,3223,True,17,True,8,True,False,True,True,False,6
5469,Dog Toy Rotation: How to Keep Your Dog Interested and Engaged,Dog Toys,3086,True,19,True,18,True,True,True,True,False,7
5467,"Pet Feeding Guide: Understanding Portions, Schedules, and Methods",Uncategorized,3234,True,19,True,0,True,True,False,True,False,6
5464,Pet Grooming Glossary: Understanding Grooming Terms and Techniques,Dog Care,3156,True,25,True,1,True,False,False,False,False,4
5462,Dog Training Terminology Explained: Key Concepts for New Owners,Dog Supplies,2819,True,26,True,1,True,False,False,True,False,7
5460,Pet Nutrition Terminology: A Guide to Common Terms on Pet Food Labels,Dog Food,2605,True,19,True,0,True,False,False,True,False,7
5458,Cat Scratching Behaviour Explained: Why Cats Scratch and How to Help,Cat Supplies,2866,True,23,True,0,True,True,True,True,False,8
5425,Dog Toys FAQ: Common Questions Answered,Dog Toys,1939,True,0,True,8,True,False,False,True,False,12
5424,Aggressive Chewer Guide: Safe Toys for Power Chewers,Dog Toys,1876,True,1,True,8,True,False,True,True,False,11
5423,Dog Toy Enrichment: Beyond Basic Fetch,Dog Toys,1899,True,1,True,8,True,False,True,True,False,11
5422,Indoor vs Outdoor Dog Toys: Choosing the Right Type,Dog Toys,1606,True,1,True,8,True,True,False,True,False,10
5421,Puppy-Safe Dog Toys: What to Look For and What to Avoid,Dog Toys,1633,True,0,True,8,True,False,False,True,False,11
5420,Dog Toy Cleaning Guide: How to Keep Toys Hygienic,Dog Toys,1918,True,2,True,8,True,True,True,True,False,10
5419,Cat Care Basics: A Glossary for New Cat Owners,Cat Supplies,2362,True,17,True,9,True,False,False,True,False,6
5418,Dog Harness Types Explained: Finding the Right Fit,Dog Harnesses,2301,True,17,True,8,True,True,False,False,False,4
5417,Puppy Care Essentials: Key Terms Every New Owner Should Know,Puppy Care,2108,True,16,True,8,True,False,False,False,False,4
5416,Dog Bed Types Explained: A Complete Glossary,Dog Beds,2179,True,17,True,8,True,True,False,False,False,4
5415,Dog Play Styles Explained: Understanding How Your Dog Plays,Dog Toys,1113,True,0,True,8,True,False,False,True,False,12
5414,Cat Toy Types Explained: A Complete Glossary,Cat Toys,1425,True,19,True,8,True,False,False,True,False,11
5296,Best Indoor Cat Toys UK (2026): Complete Guide for House Cats,Cat Toys,1660,True,12,True,8,True,False,False,True,False,8
5033,How to Choose the Right Cat Toy for Your Cat's Personality,Cat Supplies,936,True,3,True,8,True,False,False,True,False,11
5036,Understanding Cat Play Behaviour: What Different Play Styles Mean,Dog Toys,932,True,3,True,8,True,False,False,True,False,11
5032,Cat Toys FAQ: Common Questions Answered,Cat Supplies,1249,True,3,True,8,True,False,False,True,False,11
5035,Cat Enrichment Beyond Toys: Creating a Stimulating Home,Dog Toys,2023,True,7,True,8,True,False,True,True,False,11
5034,Cat Toy Rotation: How to Keep Toys Fresh and Engaging,Cat Supplies,1793,True,7,True,8,True,False,True,True,False,11
4792,Puppy Socialisation: A Complete Timeline Guide,Puppy Care,1411,True,6,True,8,True,False,False,True,False,8
4791,How to Choose the Right Dog Training Treats,Dog Supplies,1252,True,5,True,8,True,False,False,True,False,7
4790,DIY Dog Toys: Safe Homemade Options,Dog Toys,1019,True,0,True,8,True,False,False,True,False,9
4789,Best Types of Dog Toys for Different Play Styles,Dog Toys,1070,True,0,True,8,True,False,False,True,False,8
4788,Mental Stimulation for Dogs: Beyond Physical Exercise,Dog Supplies,1335,True,5,True,8,True,False,False,True,False,7
4787,Dog Toy Safety: What Every Owner Needs to Know,Dog Toys,990,True,0,True,8,True,False,False,True,False,8
4786,Where to Place Your Dog's Bed: Location and Comfort Tips,Uncategorized,1385,True,5,True,8,True,False,False,True,False,7
4785,How to Wash and Maintain Your Dog's Bed,Dog Health,1334,True,5,True,8,True,False,False,True,False,7
4784,"Dog Bed Materials Explained: Foam, Memory Foam, and More",Dog Beds,1441,True,7,True,8,True,True,False,True,False,8
4783,How to Choose the Right Dog Bed Size,Dog Beds,1202,True,6,True,8,True,False,False,True,False,8
4573,Seasonal Pet Safety: Protecting Pets Through the Year,Pet Care General,1078,True,5,True,8,True,False,False,True,False,7
4570,First-Time Dog Owner Essentials: What You Need to Know,Dog Supplies,1430,True,7,True,25,True,True,False,True,False,6
4576,Multi-Pet Household Tips: Living with Dogs and Cats Together,Pet Care General,1243,True,6,True,8,True,False,False,True,False,5
4574,Pet Hydration Guide: How Much Water Does Your Pet Need?,Pet Care General,1129,True,5,True,8,True,False,False,True,False,6
4571,Pet First Aid Basics: What Every Owner Should Know,Pet Care General,1070,True,4,True,8,True,False,False,False,False,5
4568,Dog Dental Health: A Practical Care Guide,Dog Care,910,True,0,True,15,False,False,True,True,False,8
4566,Seasonal Dog Care: Keeping Your Dog Safe Year-Round,Dog Health,1438,True,7,True,16,True,True,True,False,False,5
4563,Dog Grooming Basics: A Complete Guide for Owners,Dog Care,943,True,0,True,8,False,False,False,True,False,7
4415,Cat Toy Safety Guide: What Every Owner Should Know,Cat Supplies,908,True,0,True,13,False,False,False,True,False,13
4406,Best Interactive Cat Toys for Indoor Cats: Engagement Guide,Cat Toys,1281,True,9,True,13,True,False,False,False,False,11
4414,Harness vs Collar: Which Is Better for Your Dog?,Dog Supplies,888,True,1,True,10,False,True,True,True,False,11
4413,How to Measure Your Dog for a Harness: Step-by-Step Guide,Dog Supplies,872,True,0,True,9,False,False,True,True,False,11
4412,No-Pull Dog Harness Guide: How They Work and When to Use One,Dog Harnesses,822,True,0,True,12,False,False,False,True,False,8
4411,"Dog Harnesses: The Complete Guide to Types, Fitting, and Safety",Dog Harnesses,1246,True,1,True,16,False,True,True,True,False,11
4410,Cat Enrichment Activities Beyond Toys: Complete Guide,Dog Toys,935,True,0,True,12,False,False,False,True,False,12
4409,Kitten vs Adult Cat Toys: Age-Appropriate Play Guide,Dog Toys,859,True,0,True,21,False,False,False,True,False,11
4408,How Often Should You Replace Cat Toys? A Practical Guide,Cat Supplies,817,True,0,True,14,False,False,False,True,False,10
4407,DIY Cat Toys: Safe Homemade Options Your Cat Will Love,Cat Toys,1049,True,9,True,13,True,False,False,False,False,5
4335,Best Cat Litter Disposal UK (2026) – Waste Management Guide,Cat Supplies,1524,True,7,True,8,True,False,False,False,False,10
4328,Best Self-Cleaning Litter Trays UK (2026) – Automatic Options,Cat Supplies,1432,True,8,True,8,True,False,False,False,False,10
4321,Best Cat Litter UK (2026) – Types &#038; Comparison Guide,Cat Supplies,1458,True,9,True,8,True,False,False,False,False,10
4314,Best Cat Litter Trays UK (2026) – Complete Guide,Cat Supplies,1719,True,8,True,8,True,False,False,False,False,10
4307,Best Wall-Mounted Cat Scratchers UK (2026) – Space Saving,Cat Supplies,1424,True,8,True,8,True,False,False,False,False,10
4300,Best Cardboard Cat Scratchers UK (2026) – Budget Friendly,Cat Supplies,1406,True,8,True,8,True,False,False,False,False,10
4293,Best Cat Trees UK (2026) – Climbing & Scratching Towers,Cat Supplies,1458,True,8,True,8,True,False,False,False,False,10
4286,Best Cat Scratching Posts UK (2026) – Complete Guide,Cat Supplies,1653,True,8,True,8,True,False,False,False,False,10
4279,Best Cat Harnesses UK (2026) – Safe Walking Guide,Dog Supplies,1452,True,7,True,8,True,False,False,False,False,10
4272,Best Cat ID Tags UK (2026) – Identification Guide,Dog Supplies,1244,True,2,True,8,True,False,False,False,False,9
4265,Best Cat GPS Trackers UK (2026) – Location Tracking Guide,Uncategorized,1437,True,7,True,8,True,False,False,False,False,10
4258,Best Cat Collars UK (2026) – Complete Safety Guide,Dog Supplies,1380,True,2,True,8,True,False,False,False,False,10
4251,Best Cat Shampoo UK (2026) – When & How to Bathe,Dog Health,1459,True,8,True,8,True,False,False,False,False,10
4244,Best Cat Nail Clippers UK (2026) – Safe Trimming Guide,Cat Toys,1420,True,7,True,8,True,False,False,False,False,10
4237,Best Cat Brushes UK (2026) – Guide by Coat Type,Uncategorized,1409,True,8,True,8,True,False,False,False,False,10
4230,Best Cat Grooming Supplies UK (2026) – Complete Guide,Dog Care,1169,True,0,True,8,False,False,False,True,False,12
4223,Best Cat Window Perches UK (2026) – Sunning & Bird Watching,Cat Toys,1407,True,7,True,8,True,False,False,False,False,7
4216,Best Cat Radiator Beds UK (2026) – Hook-On Warmth Guide,Uncategorized,1356,True,7,True,8,True,False,False,False,False,7
4209,Best Heated Cat Beds UK (2026) – Winter Warmth Guide,Cat Supplies,1401,True,7,True,8,True,False,False,False,False,7
4202,Best Cat Beds UK (2026) – Complete Guide,Cat Supplies,1559,True,9,True,8,True,False,False,False,False,7
4195,Best Cat Toys for Indoor Cats UK (2026) – Enrichment Guide,Cat Toys,1412,True,8,True,8,True,False,False,False,False,8
4188,Best Catnip Toys UK (2026) – What Works and Why,Cat Toys,1466,True,8,True,8,True,False,False,False,False,13
4181,Best Interactive Cat Toys UK (2026) – Wand & Puzzle Guide,Cat Toys,1390,True,8,True,8,True,False,False,False,False,8
4174,Best Cat Toys UK (2026) – Complete Guide,Cat Supplies,1662,True,9,True,8,True,False,False,False,False,12
4167,Best Dog Water Bottles UK (2026) – Travel Hydration Guide,Pet Care General,1181,True,0,True,8,False,False,False,True,False,12
4160,Best Elevated Dog Bowls UK (2026) – Raised Feeder Guide,Dog Supplies,1243,True,0,True,8,False,False,False,True,False,12
4153,Best Slow Feeder Dog Bowls UK (2026) – Prevent Speed Eating,Dog Supplies,1484,True,9,True,8,True,False,False,True,False,10
4146,Best Dog Bowls and Feeding UK (2026) – Complete Guide,Dog Supplies,1721,True,10,True,8,True,False,False,True,False,10
4139,Best Dog Training Leads UK (2026) – Long Lines & Harnesses,Dog Supplies,1481,True,8,True,8,True,False,False,False,False,7
4132,Best Puppy Training Guide UK (2026) – First Year Essentials,Puppy Care,1491,True,9,True,8,True,False,False,True,False,7
4125,Best Dog Training Treats UK (2026) – Reward Guide,Dog Supplies,1456,True,8,True,8,True,False,False,True,False,7
4118,Best Dog Training and Behaviour UK (2026) – Complete Guide,Dog Supplies,1594,True,8,True,8,True,False,False,True,False,7
4110,Best Dog Joint Supplements UK (2026) – Mobility Support Guide,Dog Health,1539,True,9,True,8,True,False,False,False,False,7
4103,Best Dog Flea Treatment UK (2026) – Prevention Guide,Dog Health,1234,True,2,True,8,True,False,False,False,False,7
4096,Best Dog Dental Care UK (2026) – Teeth Cleaning Guide,Dog Care,1480,True,8,True,8,True,False,False,False,False,7
4089,Best Dog Health and Care UK (2026) – Complete Guide,Dog Food,1578,True,8,True,8,True,False,False,False,False,7
4078,Best Dog Nail Clippers UK (2026) – Trimming & Grinding Guide,Uncategorized,1404,True,7,True,8,True,False,False,False,False,10
4071,Best Dog Shampoo UK (2026) – Ingredients & Safety Guide,Uncategorized,1409,True,9,True,8,True,False,False,False,False,10
4064,Best Dog Brushes UK (2026) – Guide by Coat Type,Uncategorized,1500,True,9,True,8,True,False,False,False,False,10
4057,Best Dog Grooming Supplies UK (2026) – Complete Guide,Dog Care,1726,True,9,True,8,True,False,False,False,False,10
4049,Best Puppy Collars UK (2026) – First Collar & Harness Guide,Dog Supplies,1395,True,8,True,8,True,False,False,False,False,6
4042,Best Dog Leads UK (2026) – Walking & Training Lead Guide,Dog Supplies,1606,True,10,True,8,True,False,False,False,False,7
4034,Best No-Pull Dog Harnesses UK (2026) – Training & Comfort Guide,Dog Harnesses,1585,True,8,True,8,True,False,False,False,False,7
4027,Best Dog Collars and Harnesses UK (2026) – Complete Guide,Dog Supplies,1703,True,2,True,8,True,False,False,False,True,7
4018,Best Puppy Beds UK (2026) – First Bed & Crate Training Guide,Dog Beds,1717,True,9,True,8,True,False,False,True,False,7
4011,Best Cooling Dog Beds UK (2026) – Temperature Regulation Guide,Dog Beds,1654,True,9,True,8,True,False,False,True,False,7
4004,Best Orthopaedic Dog Beds UK (2026) – Joint Support Guide,Dog Beds,1715,True,11,True,8,True,False,False,True,False,7
3996,Best Dog Beds UK (2026) – Complete Guide & Honest Reviews,Dog Beds,2076,True,15,True,8,True,False,False,True,False,7
3960,Best Puppy Toys UK (2026) – Teething & First Toys Guide,Puppy Care,2393,True,19,True,8,True,False,False,True,False,7
3959,Best Interactive Dog Toys UK (2026) – Puzzle & Enrichment Guide,Dog Toys,2311,True,20,True,8,True,False,False,True,True,7
3957,Best Indestructible Dog Toys UK (2026) – Tough Toys for Heavy Chewers,Dog Toys,2161,True,15,True,8,True,False,False,True,False,7
3956,Best Dog Toys UK (2026) – Complete Guide & Honest Reviews,Dog Toys,1974,True,0,True,8,False,False,False,True,True,9
3839,Best Puppy Food UK (2026) - Growth-Stage Nutrition Guide,Dog Food,3733,True,16,True,9,True,True,False,True,False,8
3838,Dry vs Wet Dog Food UK - An Honest Comparison Guide,Dog Food,3234,True,16,True,8,True,True,False,True,False,8
3837,Best Dry Dog Food UK (2026) - Evidence-Based Guide,Dog Food,4254,True,13,True,8,True,True,False,True,False,8
3836,Best Dog Food UK (2026) - Complete Buying Guide,Dog Food,5558,True,3,True,8,True,True,False,True,False,5
696,Essential Cat Supplies for Cat Owners - Number 1 Must-Haves,Dog Supplies,1266,True,3,True,9,True,False,False,True,False,13
3,Dog Toys UK (2026) – Essential Guide for Pet Owners,Dog Toys,869,True,4,True,9,True,False,False,True,False,9
