post_id,title,links_added,status
4407,DIY Cat Toys: Safe Homemade Options Your Cat Will Love,5,updated
4406,Best Interactive Cat Toys for Indoor Cats: Engagement Guide,5,updated
4408,How Often Should You Replace Cat Toys? A Practical Guide,0,already_present
4787,Dog Toy Safety: What Every Owner Needs to Know,0,already_present
4786,Where to Place Your Dog's Bed: Location and Comfort Tips,0,already_present
4785,How to Wash and Maintain Your Dog's Bed,0,already_present
4576,Multi-Pet Household Tips: Living with Dogs and Cats Together,0,already_present
4571,Pet First Aid Basics: What Every Owner Should Know,5,updated
4573,Seasonal Pet Safety: Protecting Pets Through the Year,0,already_present
4789,Best Types of Dog Toys for Different Play Styles,0,already_present
4791,How to Choose the Right Dog Training Treats,0,already_present
5415,Dog Play Styles Explained: Understanding How Your Dog Plays,0,already_present
